name	registration_no
SEE DEVELOPMENT CONSULTANTS	PV87360
SEE DONE	PV00223769
SEE FASHION TRADING	PV124394
SEE HELA AGRO	PV00232941
SEE HELA NATURAL AGRICULTURE	PV00250118
SEE LANKA	PV00243446
SEE LANKA PAINTS	PV10723
SEE LANKA TRAVELS	PV84618
SEE LANKA VOYAGES	PV120967
SEE MEGA HOMES & HARDWARE	PV00253766
SEE ONE AYURVEDA AND SPA	PV00219405
SEE TWELVE	PV00271039
SEE WEDDING AND EVENT PLANER	PV118665
SEE/SA GALLA MAGEE PRAWAHANA SAMAGAMA	PB5017
SEE/SA HALAWATHA MAGEE PRAVAHANA SAMAGAMA	PB5007
SEE/SA MAHANUWARA - KOLAMBA (SUKOPABHOGEE SEVA) MAGEE PRAVAHANA SAMAGAMA	PB5053
SEE/SA NUWARAELIYA MAGEE PRAVAHANA SAMAGAMA	PB5052
SEE/SA VAVUNIYA MAGEE PRAVAHANA SAMAGAMA	PB5014
SEEAMASAHITHA (JANATHA) HALIALA SAMAGIPURA GAMIDIRIYA SAMAGAMA	PB3264
SEEAMLES ENTERPRISE SOLUTIONS	PV00217208
SEEBISNET	PV00218590
SEEBO NETWORKS LANKA	PV100822
SEECO STEEL COMAPNY	PV85372
SEED - AG MARKETING	PV20012
SEED CAFE	PV00215912
SEED CAPITAL AND CONSULTANCY	PV00276222
SEED CAPITAL INVESTMENTS	PV77650
SEED OF LIFE	PV00242641
SEED STAYS AND SOCIAL	PV00292029
SEED SUITE HOLDINGS	PV00241898
SEED TRAFFIC	
SEED VENTURES LANKA	PV89252
SEEDAVI FOOD PRODUCTS	PV119440
SEEDBYTE	PV00273312
SEEDEVEE OFFSET	PV19478
SEEDEVI GLASS	PV113444
SEEDEVI MOTORS	PV18351
SEEDEVI SPICE EXPORTS  LANKA	PV00205398
SEEDEVI SPICE EXPORTS	PV66103
SEEDMEN'S ASSOCIATION OF LANKA	GA00233061
SEEDPOD	PV128858
SEEDS	
SEEDS-TEK	PV00248724
SEEDUWA DREAMS HOMES	PV76470
SEEDUWA HOSPITALS	PV00227075
SEEDUWA MOTORS	PV00239125
SEEDUWA RESORTS	PV81836
SEEDUWA SAKURA LEGENDS	PV00275585
SEEDUWA SAMADHE ELDERS HOME	PV00227005
SEEEMASAHITHA (JANATHA) SURIYAGODA GAMIDIRIYA SAMAGAMA	PB3246
SEEFIRST EDUCATION	PV00227831
SEEFIRST GROUP	PV00219941
SEEFIRST HOLDINGS	PV00219182
SEEFIRST MEDIA	PV00233772
SEEFLIX	PV00225571
SEEGAR ENGINEERING	PV00241125
SEEGER VIEW	PV129881
SEEGIRI SIRI ASAPUWA	PV102925
SEEGO LEISURE N HOLIDAYS	PV00201368
SEEHA AID	GL2442
SEEHELA JANA SANWARDANA PERAMUNA	GA00202582
SEEHELA TV	PV00257729
SEEIKO MARKETING LANKA	PV00223046
SEEINGO LANKA	PV121687
SEEJAYA STEEL FURNITURES	PV75375
SEEK CONSULTANTS	PV00208713
SEEK DIGITAL	PV00259175
SEEK ENERGY	PV00228809
SEEK KNOWLEDGE CAMPUS	PV00293223
SEEK MICRO CREDIT	PV115741
SEEK MY SERVICE	PV97553
SEEK WEALTH MANAGEMENT	PV00242278
SEEKER HOLDINGS	PV63202
SEEKERS LANKA	PV00279162
SEEKERS RESEARCH	PV67508
SEEKERS VACATION	PV116842
SEEKERS WORLDWIDE	PV69309
SEEKING ALOT OCEAN	PV00250982
SEEKING ALOT OCEAN LANKA	PV00255713
SEEKKUARACHCHI AGGREGATE SUPPLIERS	PV00241696
SEELAN EDUCATION	PV00291160
SEELAN FOOD AND BEVERAGES	PV84117
SEELAN FOOD PRODUCTS	PV00279556
SEELAS	PV00230831
SEELAWATHI SEVANA	PV76317
SEEMA AGENCY LANKA	PV73527
SEEMASAHIHA (JANATHA) NAHAKADIYA GAMIDIRIYA SAMAGAMA	PB3475
SEEMASAHIHTA KIMMANTHUDAWA GAMANEGUMA JANATHA SAMAGAMA	PB3778
SEEMASAHIHTA THUNDOLA GAMANEGUMA JANATHA SAMAGAMA	PB3777
SEEMASAHITAH(JANATHA) WALASBEDDA ELLA GEMIDIRIYA SAMAGAMA	PB3447
SEEMASAHITH (JANATHA) MATARA DISTRIK BASRATHA AYOJAKAYANGE SAMAGAMA	PB1263
SEEMASAHITH ULPOTHA PARA EKSATH GOVI	PV65698
SEEMASAHITHA ( JANATHA) GOVINDUPURA GAMIDIRIYA SAMAGAMA (N(EPV) 648)	PB1412
SEEMASAHITHA ( JANATHA) KOMARIKA GAMIDIRIYA SAMAGAMA	PB3165
SEEMASAHITHA (DAYARABA DAKUNA GAMIDIRIYA SAMAGAMA	PB3506
SEEMASAHITHA (JANATH) THITHTHAWELPATHA GAMIDIRIYA SAMAGAMA	PB3185
SEEMASAHITHA (JANATHA( ALUGALGE GAMIDIRIIYA SAMAGAMA (NEPV 191)	PB1645
SEEMASAHITHA (JANATHA) ADUPALANA GAMIDIRIYA SAMAGAMA	PB3092
SEEMASAHITHA (JANATHA) AGALABADA EKAMUTHU GAMIDIRIYA SAMAGAMA	PB972
SEEMASAHITHA (JANATHA) AGRAHERA GAMIDIRIYA SAMAGAMA	PB593
SEEMASAHITHA (JANATHA) AKURUKADUWA GAMIDIRIYA SAMAGAMA	PB3095
SEEMASAHITHA (JANATHA) ALAKOLAELLA GAMIDIRIYA SAMAGAMA	PB3400
SEEMASAHITHA (JANATHA) ALANA GEMIDIRIYA SAMAGAMA	PB3065
SEEMASAHITHA (JANATHA) ALIOLUARA GAMIDIRIYA SAMAGAMA	PB3305
SEEMASAHITHA (JANATHA) ALLAKANDA GAMIDIRIYA SAMAGAMA	PB481
SEEMASAHITHA (JANATHA) ALLEGAMA GAMIDIRIYA SAMAGAMA	PB1110
SEEMASAHITHA (JANATHA) ALLEVELA NAGENAHIRA GAMIDIRIYA SAMAGAMA (NEPV 634)	PB1610
SEEMASAHITHA (JANATHA) ALLEWELA NEGENAHIRA GAMIDIRIYA SAMAGAMA	PB1189
SEEMASAHITHA (JANATHA) ALUTH IHALA DAKUNA GAMIDIRIIYA SAMAGAMA (NEPV 271)	PB1690
SEEMASAHITHA (JANATHA) ALUTHGODA GAMIDIRIYA SAMAGAMA	PB3041
SEEMASAHITHA (JANATHA) ALUTWELGAMA GAMIDIRIYA SAMAGAMA	PB3082
SEEMASAHITHA (JANATHA) AMBAGAHAYAYA GAMIDIRIYA SAMAGAMA (NEPV260)	PB3236
SEEMASAHITHA (JANATHA) AMBAGASDOWA GAMIDIRIYA SAMAGAMA	PB826
SEEMASAHITHA (JANATHA) AMBALA BATAHIRA GAMIDIRIYA SAMAGAMA	PB915
SEEMASAHITHA (JANATHA) AMBALA UTURA GAMIDIRIYA SAMAGAMA (NEPV 726)	PB1672
SEEMASAHITHA (JANATHA) AMBEWELA GAMIDIRIYA SAMAGAMA	PB3432
SEEMASAHITHA (JANATHA) AMMADUWA GAMIDIRIYA SAMAGAMA	PB3028
SEEMASAHITHA (JANATHA) AMUNUTENNA GAMIDIRIYA SAMAGAMA	PB626
SEEMASAHITHA (JANATHA) ANDARAWEWA GAMIDIRIYA SAMAGAMA	PB3322
SEEMASAHITHA (JANATHA) ARABOWA GAMIDIRIYA SAMAGAMA (NEPV 533)	PB1767
SEEMASAHITHA (JANATHA) ATAMBA OYA GAMDIRIYA SAMAGAMA	PB3486
SEEMASAHITHA (JANATHA) ATHAPATHTHUKANDA GAMIDIRIYA SAMAGAMA (NEPV 436)	PB1609
SEEMASAHITHA (JANATHA) ATHPITIYA DAKUNA GAMIDIRIYA SAMAGAMA (PEOPLES) (NEPV (P) 555)	PB1349
SEEMASAHITHA (JANATHA) ATHPITIYA UTHURA GEMIDIRIYA SAMAGAMA	PB969
SEEMASAHITHA (JANATHA) ATHURALIYA BATAHIRA GAMIDIRIYA SAMAGAMA	PB1164
SEEMASAHITHA (JANATHA) AUKETIYAWA GAMIDIRIYA SAMAGAMA	PB941
SEEMASAHITHA (JANATHA) BADUNGALA GAMIDIRIYA SAMAGAMA (NEPV 564)	PB1760
SEEMASAHITHA (JANATHA) BALABEDDA GEMIDIRIYA SAMAGAMA(NEPV (P) 663)	PB1353
SEEMASAHITHA (JANATHA) BALAGOLLA GEMIDIRIYA SANGAMAYA	PB502
SEEMASAHITHA (JANATHA) BALAHARUWA GAMIDIRIYA SAMAGAMA	PB1265
SEEMASAHITHA (JANATHA) BALAHURUWA ANANDAPURA GAMIDIRIYA SANMAGAMA	PB1237
SEEMASAHITHA (JANATHA) BALAKOTUNNA GAMIDIRIYA SAMAGAMA	PB607
SEEMASAHITHA (JANATHA) BALANGODA MORAHELA GAMIDIRIYA SAMAGAMA	PB3371
SEEMASAHITHA (JANATHA) BALANGODA PALLEWELA GAMIDIRIYA SAMAGAMA	PB3372
SEEMASAHITHA (JANATHA) BALANGODA UDAGAMA GAMIDIRIYA SAMAGAMA	PB3368
SEEMASAHITHA (JANATHA) BAMBARAGALA THELAMBUGAHAARA GAMIDIRIYA SAMAGAMA	PB3278
SEEMASAHITHA (JANATHA) BAMBARAPANA GAMIDIRIYA SAMAGAMA	PB3436
SEEMASAHITHA (JANATHA) BAMBARAWANA GAMIDIRIYA SAMAGAMA	PB623
SEEMASAHITHA (JANATHA) BANAGODA GEMIDIRIYA SAMAGAMA	PB798
SEEMASAHITHA (JANATHA) BANDOKKAYAYA GAMIDIRIYA SAMAGAMA	PB3099
SEEMASAHITHA (JANATHA) BANGAMUKANDA GAMIDIRIYA SAMAGAMA (NEPV 317)	PB1386
SEEMASAHITHA (JANATHA) BARAGAMA DAKUNA GAMIDIRIYA SAMAGAMA	PB1125
SEEMASAHITHA (JANATHA) BARANDUWA GEMIDIRIYA SAMAGAMA	PB953
SEEMASAHITHA (JANATHA) BATAHIRA DEBOKKAWA GAMIRIDIYA SAMAGAMA (NEPV405)	PB1784
SEEMASAHITHA (JANATHA) BATHALAYAYA GAMIDIRIYA SAMAGAMA	PB3204
SEEMASAHITHA (JANATHA) BATHALAYAYA IHALA GAMIDIRIYA SAMAGAMA (PEOPLES)	PB804
SEEMASAHITHA (JANATHA) BATHALEWEWA GAMIDIRIYA SAMAGAMA	PB483
SEEMASAHITHA (JANATHA) BEDDEWELA SAMAGI GAMIDIRIYA SAMAGAMA	PB3533
SEEMASAHITHA (JANATHA) BEDDEWEWA GAMIDIRIYA SAMAGAMA	PB3304
SEEMASAHITHA (JANATHA) BEDIGAMA UTHURA ALOKA GAMIDIRIYA SAMAGAMA (NEPV 407)	PB1474
SEEMASAHITHA (JANATHA) BEDIYAWA GAMIDIRIYA SAMAGAMA	PB3080
SEEMASAHITHA (JANATHA) BELLANKANDA GAMIDIRIYA SAMAGAMA	PB3404
SEEMASAHITHA (JANATHA) BERALIYAPOLA GAMIDIRIYA SAMAGAMA	PB1314
SEEMASAHITHA (JANATHA) BIBILEGAMA BATAHIRA PAHALA GAMIDIRIYA SAMAGAMA	PB3069
SEEMASAHITHA (JANATHA) BINTENNA GAMIDIRIYA SAMAGAMA (NEPV 534)	PB1557
SEEMASAHITHA (JANATHA) BOGAHAARAWA KARAPINCHAGALAYAYA GEMIDIRIYA SAMAGAMA	PB3030
SEEMASAHITHA (JANATHA) BOGAHAKUMBURA GAMIDIRIYA SAMAGAMA	PB3056
SEEMASAHITHA (JANATHA) BOGAHAPELESSA GAMIDIRIYA SAMAGAMA	PB648
SEEMASAHITHA (JANATHA) BOGODA GAMIDIRIYA SAMAGAMA	PB465
SEEMASAHITHA (JANATHA) BOHITIYA GAMIDIRIYA SAMAGAMA	PB3137
SEEMASAHITHA (JANATHA) BORALUHENA GAMIDIRIYA SAMAGAMA (NEPV 284)	PB1791
SEEMASAHITHA (JANATHA) BOWALAGAMA GAMIDIRIYA SAMAGA	PB3175
SEEMASAHITHA (JANATHA) BUBULA GAMIDIRIYA SAMAGAMA	PB3267
SEEMASAHITHA (JANATHA) BUDUGEKANDA GAMIDIRIYA SAMAGAMA (NEPV 565)	PB1770
SEEMASAHITHA (JANATHA) BUDUNWELA GAMIDIRIYA SAMAGAMA	PB3362
SEEMASAHITHA (JANATHA) BUDURUWAGALA ISURU GAMIRIYA SAMAGAMA	PB406
SEEMASAHITHA (JANATHA) BULUPITIYA GAMIDIRIYA SAMAGAMA	PB3150
SEEMASAHITHA (JANATHA) BUNGIRIYA GAMIDIRIYA SAMAGAMA	PB3484
SEEMASAHITHA (JANATHA) BUSDULLA GAMIDIRIYA SAMAGAMA (NEPV 443)	PB1502
SEEMASAHITHA (JANATHA) DAHAAMUNA GAMIDIRIYA SAMAGAMA	PB3021
SEEMASAHITHA (JANATHA) DAHAGONIYA GAMIDIRIYA SAMAGAMA	PB3066
SEEMASAHITHA (JANATHA) DAKUNA GILEEMALE PAHALA GEMIDIRIYA SAMAGAMA	PB385
SEEMASAHITHA (JANATHA) DAKUNU KANUMULDENIYA GAMIDIRIYA SAMAGAMA	PB1099
SEEMASAHITHA (JANATHA) DAKUNU KEPPETIYAWA GAMIDIRIYA SAMAGAMA	PB1228
SEEMASAHITHA (JANATHA) DAMBANA GAMIDIRIYA SAMAGAMA (NEPV 759)	PB1503
SEEMASAHITHA (JANATHA) DANGAMUWA GAMIDIRIYA SAMAGAMA	PB3452
SEEMASAHITHA (JANATHA) DAWATEGAMA GAMIDIRIIYA SAMAGAMA (NEPV 263)	PB1688
SEEMASAHITHA (JANATHA) DEBOKKAWA GAMIDIRIYA SAMAGAMA (NEPV 290)	PB1489
SEEMASAHITHA (JANATHA) DEDDUWAWALA GAMIDIRIYA SAMAGAMA	PB928
SEEMASAHITHA (JANATHA) DEEKIRIGOLLA GAMIDIRIYA SAMAGAMA (NEPV 572)	PB1796
SEEMASAHITHA (JANATHA) DEGAMPOTHA GAMIDIRIYA SAMAGAMA	PB1227
SEEMASAHITHA (JANATHA) DEHENAKANDA GEMIDIRIYA SAMAGAMA	PB610
SEEMASAHITHA (JANATHA) DEHERAGODA PARANAGAMA GEMIDIRIYA SAMAGAMA	PB841
SEEMASAHITHA (JANATHA) DEHIGAMA UTHURA GAMIDIRIYA SAMAGAMA	PB460
SEEMASAHITHA (JANATHA) DEHIGOLLA PALLEGAMA GAMIDIRIYA SAMAGAMA	PB3103
SEEMASAHITHA (JANATHA) DEMATAPASSA WIJAYA GAMIDIRIYA SAMAGAMA	PB852
SEEMASAHITHA (JANATHA) DEMBUWANA GAMIDIRIYA SAMAGAMA	PB3528
SEEMASAHITHA (JANATHA) DEVIPAHALA THEBHUWANA GAMIDIRIYA SAMAGAMA	PB1065
SEEMASAHITHA (JANATHA) DIDDENIPOTHA NEGENAHIRA GAMIDIRIYA SAMAGAMA	PB1019
SEEMASAHITHA (JANATHA) DIGOGEDARA GAMIDIRIYA SAMGAMA (NPBS/CGB 477)	PB1518
SEEMASAHITHA (JANATHA) DIKKAPITIYA GAMIDIRIYA SAMAGAMA (NEPV 442)	PB1457
SEEMASAHITHA (JANATHA) DIKKUMBURA GAMIDIRIYA SAMAGAMA	PB3034
SEEMASAHITHA (JANATHA) DIKPITIYA GAMIDIRIYA SAMAGAMA	PB821
SEEMASAHITHA (JANATHA) DIRIYAGAGAMA GAMIDIRIYA SAMAGAMA (NEPV 495)	PB1578
SEEMASAHITHA (JANATHA) DODAMPE NAGODA GAMIDIRIYA SAMAGAMA	PB1057
SEEMASAHITHA (JANATHA) DODANGASWINNA IHALA GAMIDIRIYA SAMAGAMA (NEPV 376)	PB1783
SEEMASAHITHA (JANATHA) DOMBAGASWINNA GAMIDIRIYA SAMAGAMA (NEPV 217)	PB1674
SEEMASAHITHA (JANATHA) DOVA DIKARAWA GAMIDIRIYA SAMAGAMA	PB3495
SEEMASAHITHA (JANATHA) DUMBARA MANANA GAMIDIRIYA SAMAGAMA	PB3392
SEEMASAHITHA (JANATHA) EETHANAWATTA GAMIDIRIYA SAMAGAMA	PB3157
SEEMASAHITHA (JANATHA) EGODABEDDA GAMIDIRIYA SAMAGAMA	PB1010
SEEMASAHITHA (JANATHA) EGODAKOTAGAMA GEMIDIRIYA SAMAGAMA	PB3253
SEEMASAHITHA (JANATHA) EGODAMALWALA GEMIDIRIYA SAMAGAMA	PB1069
SEEMASAHITHA (JANATHA) EGODAWATTA ILUKPITIYA MAHAGODAYAYA GAMIDIRIYA SAMAGAMA (N(EPV) 194)	PB1416
SEEMASAHITHA (JANATHA) EKSATH MORAKETIYA GEMIDIRIYA SAMAGAMA	PB558
SEEMASAHITHA (JANATHA) ELDENIYA GAMIDIRIYA SAMAGAMA (NEPV 756)	PB1671
SEEMASAHITHA (JANATHA) ELLA IHALA GAMIDIRIIYA SAMAGAMA (NEPV 563)	PB1689
SEEMASAHITHA (JANATHA) ELLEKONA GAMIDIRIYA SAMAGAMA (NEPV 613)	PB1759
SEEMASAHITHA (JANATHA) ELLEWELA GAMIDIRIYA SAMAGAMA	PB3215
SEEMASAHITHA (JANATHA) ELPITIYA GAMIDIRIYA SAMAGAMA (NEPV 570)	PB1718
SEEMASAHITHA (JANATHA) EMBULDENIYA GEMIDIRIYA SAMAGAMA	PB518
SEEMASAHITHA (JANATHA) ERATHNA GEMIDIRIYA SAMAGAMA	PB400
SEEMASAHITHA (JANATHA) GAHALAKOLADENIYA GAMIDIRIYA SAMAGAMA	PB874
SEEMASAHITHA (JANATHA) GALBOKKA GAMA GAMIDIRIYA SAMAGAMA	PB1143
SEEMASAHITHA (JANATHA) GALBOKKA GAMIDIRIYA SAMAGAMA (NEPV (P) 423)	PB1350
SEEMASAHITHA (JANATHA) GALEWELA GAMIDIRIYA SAMAGAMA	PB913
SEEMASAHITHA (JANATHA) GALPAYA NEGENAHIRA GAMIDIRIYA SAMAGAMA	PB3016
SEEMASAHITHA (JANATHA) GALPOTHUKANDA GAMIDIRIYA SAMAGAMA (NEPV 547)	PB1561
SEEMASAHITHA (JANATHA) GALUKAGAMA GAMIDIRIYA SAMAGAMA	PB1253
SEEMASAHITHA (JANATHA) GALWEWA GAMIDIRIYA SAMAGAMA (NEPV 724)	PB1670
SEEMASAHITHA (JANATHA) GALWEWA HADIYA SIYATHA GAMIDIRIYA SAMAGAMA	PB3328
SEEMASAHITHA (JANATHA) GAMBEDDA GAMIDIRIYA SAMAGAMA	PB569
SEEMASAHITHA (JANATHA) GANGODAGAMA GAMIDIRYA SAMAGAMA	PB1178
SEEMASAHITHA (JANATHA) GANGODAKANDA GAMIDIRIYA SAMAGAMA	PB3386
SEEMASAHITHA (JANATHA) GAVARAGIRIYA GAMIDIRIYA SAMAGAM (NEPV 431)	PB1779
SEEMASAHITHA (JANATHA) GAVARAWELA GAMIGIRIYA SAMAGAMA	PB3412
SEEMASAHITHA (JANATHA) GINNORUWA GAMIDIRIIYA SAMAGAMA (NEPV 741)	PB1691
SEEMASAHITHA (JANATHA) GIRAMBE GAMIDIRIYA SAMAGAMA	PB1080
SEEMASAHITHA (JANATHA) GIRITHALE GOVI SAMAGAMA (NEPV 53)	PB1799
SEEMASAHITHA (JANATHA) GODALIDA GAMIDIRIYA SAMAGAMA (NEPV 600)	PB1774
SEEMASAHITHA (JANATHA) GODAMUNA DAKUNA GAMIDIRIYA SAMAGAMA	PB1053
SEEMASAHITHA (JANATHA) GODAMUNA UTHURA GAMIDIRIYA SAMAGAMA (NEPV685)	PB1383
SEEMASAHITHA (JANATHA) GODAVANAGODA NAVODYA GAMIDIRIYA SAMAGAMA	PB3109
SEEMASAHITHA (JANATHA) GONAGANARA GAMIDIRIYA SAMAGAMA	PB1380
SEEMASAHITHA (JANATHA) GONAPITIYA GAMIDIRIYA SAMAGAMA	PB565
SEEMASAHITHA (JANATHA) GONATALAWA GAMIDIRIYA SAMAGAMA (NEPV 621)	PB1716
SEEMASAHITHA (JANATHA) GURUBAWLAGAMA GAMIDIRIYA SAMAGAMA	PB799
SEEMASAHITHA (JANATHA) GURUHELA GAMIDIRIYA SAMAGAMA (NEPV664)	PB1391
SEEMASAHITHA (JANATHA) HADIWATTA GAMIDIRIYA SAMAGAMA	PB1335
SEEMASAHITHA (JANATHA) HAGUNAWA GAMIDIRIYA SAMAGAMA	PB3471
SEEMASAHITHA (JANATHA) HAKAGIKKA GAMIDIRIYA SAMAGAMA	PB3468
SEEMASAHITHA (JANATHA) HAKBELIARA GAMIDIRIYA SAMAGAMA	PB3255
SEEMASAHITHA (JANATHA) HALDOLA GAMIDIRIYA SAMAGAMA	PB3250
SEEMASAHITHA (JANATHA) HALKANDALIYA GAMIDIRIYA SAMAGAMA	PB3261
SEEMASAHITHA (JANATHA) HALPAWALA GAMIDIRIYA SAMAGAMA (NEPV 373)	PB1461
SEEMASAHITHA (JANATHA) HALPAWALA HANDURUKANDA GAMIDIRIYA SAMAGAMA	PB1101
SEEMASAHITHA (JANATHA) HALPE TEPELGAMA GAMIDIRIYA SAMAGAMA	PB1147
SEEMASAHITHA (JANATHA) HANDUKANDA GAMIDIRIYA SAMAGAMA	PB898
SEEMASAHITHA (JANATHA) HANGUMA GAMIDIRIYA SAMAGAMA	PB3160
SEEMASAHITHA (JANATHA) HARANKAHAWA GAMIDIRIYA SAMAGAMA	PB3489
SEEMASAHITHA (JANATHA) HATHARABAGE GAMIDIRIYA SAMAGAMA	PB3354
SEEMASAHITHA (JANATHA) HATHKIDA GEMIDIRIYA SAMAGAMA	PB3439
SEEMASAHITHA (JANATHA) HATHPORUWA SRI PURA GAMIDIRIYA SAMAGAMA	PB3317
SEEMASAHITHA (JANATHA) HATHPORUWA SUHADA GEMIDIRIYA SAMAGAMA	PB3318
SEEMASAHITHA (JANATHA) HAVANDANA GAMIDIRIYA SAMAGAMA	PB3133
SEEMASAHITHA (JANATHA) HEENARA GAMIDIRIYA SAMAGAMA (NEPV (P) 670)	PB1358
SEEMASAHITHA (JANATHA) HELABADAYAYAGAMA GAMIDIRIYA SAMAGAMA	PB3172
SEEMASAHITHA (JANATHA) HELAYALKUMBURA GAMIDIRIYA SAMAGAMA (NEPV 224)	PB1507
SEEMASAHITHA (JANATHA) HELLALA NEGENAHIRA GAMIDIRIYA SAMAGAMA	PB3312
SEEMASAHITHA (JANATHA) HENGILIELLA GAMIDIRIYA SAMAGAMA (NEPV 446)	PB1811
SEEMASAHITHA (JANATHA) HETTIGEDARA GAMIDIRIYA SAMAGAMA	PB590
SEEMASAHITHA (JANATHA) HEWAMANAGODA GAMIDIRIYA SAMAGAMA	PB3230
SEEMASAHITHA (JANATHA) HIDI KIULA RATMALGAMA GAMIDIRIYA SAMAGAMA	PB3221
SEEMASAHITHA (JANATHA) HILLAGEAINA GAMIDIRIYA SAMAGAMA	PB559
SEEMASAHITHA (JANATHA) HIMBILIYAGOLLA GAMIDIRIYA SAMAGAMA	PB3441
SEEMASAHITHA (JANATHA) HINGURU KADUWA GAMIDIRIYA SAMAGAMA	PB586
SEEMASAHITHA (JANATHA) HINGURUGAMUWA GAMIDIRIYA SAMAGAMA	PB920
SEEMASAHITHA (JANATHA) HINORANGOLLA GAMIDIRIYA SAMAGAMA	PB3209
SEEMASAHITHA (JANATHA) HIRIPITIYAHATHALIHAGAMA GAMIDIRIYA SAMAGAMA	PB1151
SEEMASAHITHA (JANATHA) HOBARIYAWA GAMIDIRIYA SAMAGAMA	PB3098
SEEMASAHITHA (JANATHA) HORABOKKA SAMPATH GEMIDIRIYA SAMAGAMA	PB1121
SEEMASAHITHA (JANATHA) HORAMULA GAMIDIRIYA SAMAGAMA	PB3231
SEEMASAHITHA (JANATHA) HORAVINNA GAMIDIRIYA SAMAGAMA	PB1327
SEEMASAHITHA (JANATHA) IDALGASHINNA GAMIDIRIYA SAMAGAMA	PB3505
SEEMASAHITHA (JANATHA) IDAMEGAMA GAMIDIRIYA SAMAGAMA	PB3448
SEEMASAHITHA (JANATHA) IHALA AADALUWA GAMIDIRIYA SAMAGAMA	PB3101
SEEMASAHITHA (JANATHA) IHALA BELIGALLA NEGENAHIRA GAMIDIRIYA SAMAGAMA (NEPV 725)	PB1662
SEEMASAHITHA (JANATHA) IHALA GILIMALE GAMIDIRIYA SAMAGAMA	PB1056
SEEMASAHITHA (JANATHA) IHALA KOTAWERA GAMIDIRIYA SAMAGAMA	PB806
SEEMASAHITHA (JANATHA) IHALAGALAGAMA GAMIDIRIYA SAMAGAMA	PB3361
SEEMASAHITHA (JANATHA) IHAWA GAMIDIRIYA SAMAGAMA (NEPV 579(	PB1753
SEEMASAHITHA (JANATHA) IKIRIYAGODA UTHURA GAMIDIRIYA SAMAGAMA (NEPV 330)	PB1673
SEEMASAHITHA (JANATHA) ILUKPELLESSA GAMIDIRIYA SAMAGAMA	PB3546
SEEMASAHITHA (JANATHA) IMBULGODA GAMIDIRIYA SAMAGAMA	PB3114
SEEMASAHITHA (JANATHA) INDIGASELLA GAMIDIRIYA SAMAGAMA (NEPV665)	PB1374
SEEMASAHITHA (JANATHA) INDIGASMULLA GAMIDIRIYA SAMAGAMA	PB3174
SEEMASAHITHA (JANATHA) INDIKETIYAGODA GAMIDIRIYA SAMAGAMA(NEPV (P) 735)	PB1348
SEEMASAHITHA (JANATHA) JAGULLA DAKUNA GAMIDIRIYA SAMAGAMA	PB579
SEEMASAHITHA (JANATHA) JANATHAPURA DAKUNA GEMIDIRIYA SAMAGAMA	PB3256
SEEMASAHITHA (JANATHA) JAYAMINI GAMIDIRIYA SAMAGAMA	PB1269
SEEMASAHITHA (JANATHA) JAYANTHIPURA GAMIDIRIYA SAMAGAMA	PB3094
SEEMASAHITHA (JANATHA) KABALLAKETIYA GAMIDIRIYA SAMAGAMA (N(EPV)(P) 628)	PB1367
SEEMASAHITHA (JANATHA) KABILLADENI GAMIDIRIYA SAMAGAMA(NEPV	PB1028
SEEMASAHITHA (JANATHA) KABILLEGAMA GAMIDIRIYA SAMAGAMA (NEPV 197)	PB1808
SEEMASAHITHA (JANATHA) KADAMADITTA GAMIDIRIYA SAMAGAMA	PB592
SEEMASAHITHA (JANATHA) KADIRAGODA GAMIDIRIYA SAMAGAMA	PB3111
SEEMASAHITHA (JANATHA) KAHADAWA GAMIDIRIYA SAMAGAMA (NEPV 255)	PB1761
SEEMASAHITHA (JANATHA) KAHAGOLLA GAMIDIRIYA SAMAGAMA (NEPV 192)	PB1739
SEEMASAHITHA (JANATHA) KAHAWATTA BATAHIRA GAMIDIRIYA	PB3033
SEEMASAHITHA (JANATHA) KAHAWATTA GAMIDIRIYA SAMAGAMA (NEPV 732)	PB1675
SEEMASAHITHA (JANATHA) KALAGAHAKIULA GAMIDIRIYA SAMAGAMA (NEPV 319)	PB1757
SEEMASAHITHA (JANATHA) KALAHAGALA EKAMUTHU GAMIDIRIYA SAMAGAMA	PB3544
SEEMASAHITHA (JANATHA) KALAHAGALA SAMAGI GAMIDIRIYA SAMAGAMA	PB3545
SEEMASAHITHA (JANATHA) KALAWELWALA GAMIDIRIYA SAMAGAMA(NEPV (P) 542)	PB1357
SEEMASAHITHA (JANATHA) KALUGOLLAYAYA GAMIDIRIYA SAMAGAMA (NEPV 649)	PB1388
SEEMASAHITHA (JANATHA) KALUKELE GAMIDIRIYA SAMAGAMA	PB1320
SEEMASAHITHA (JANATHA) KALUKULE GAMIDIRIYA SAMAGAMA	PB625
SEEMASAHITHA (JANATHA) KAMBURUGAMUWA GEMIDIRIYA SAMAGAMA	PB3225
SEEMASAHITHA (JANATHA) KANAWEGALLLA GAMIDIRIYA SAMAGAMA	PB3156
SEEMASAHITHA (JANATHA) KANDEARA GAMIDIRIYA SAMAGAMA	PB1641
SEEMASAHITHA (JANATHA) KANDUBEDDA GAMIDIRIIYA SAMAGAMA (NEPV 327)	PB1694
SEEMASAHITHA (JANATHA) KAPPETIYAWA GEMIDIRIYA SANGAMAYA	PB1471
SEEMASAHITHA (JANATHA) KAPUKINISSAYAYA SHAKTHI GAMIDIRIYA SAMAGAMA	PB3309
SEEMASAHITHA (JANATHA) KARADUGALA GAMIDIRIYA SAMAGAMA	PB3147
SEEMASAHITHA (JANATHA) KARAGAHAWALA SHAKTHI GAMIDRIYA SAMAGAMA(NEPV (P) 540)	PB1356
SEEMASAHITHA (JANATHA) KARAGAHAWELA BATAHIRA GAMIDIRIYA SAMAGAMA	PB3153
SEEMASAHITHA (JANATHA) KARAGAHAWELA NEGENAHIRA GAMIDIRIYA SAMAGAMA	PB3252
SEEMASAHITHA (JANATHA) KARAGAHAYAYA GAMIDIRIYA SAMAGAMA	PB3235
SEEMASAHITHA (JANATHA) KARAKELLA DIRIYA GAMIDIRIYA SAMAGAMA	PB3463
SEEMASAHITHA (JANATHA) KARAMBAGODAGAMA GAMIDIRIYA SAMAGAMA (NEPV 658)	PB1792
SEEMASAHITHA (JANATHA) KARAMBAKETIYA GAMIDIRIYA SAMAGAMA(NEPV (P) 714)	PB1345
SEEMASAHITHA (JANATHA) KARANDAGAMA GAMIDIRIYA SAMAGAMA (NEPV 672)	PB1795
SEEMASAHITHA (JANATHA) KARAWETIYA UTHURA GAMIDIDIRYA SAMAGMA (NEPV 521)	PB1581
SEEMASAHITHA (JANATHA) KATUGAHAGALGE JANAPADAYA GAMIDIRIYA SAMAGAMA (NEPV 604)	PB1501
SEEMASAHITHA (JANATHA) KATUGAHAGALGEGAMA GAMIDIRIYA SAMAGAMA	PB1788
SEEMASAHITHA (JANATHA) KATUGALLA GAMIDIRIYA SAMAGAMA (NEPV 488)	PB1773
SEEMASAHITHA (JANATHA) KEENAGODAGAMA GAMIDIRIYA SAMAGAMA	PB3068
SEEMASAHITHA (JANATHA) KEENAKELE GAMIDIRIYA SAMGAMA (NEPV561)	PB1533
SEEMASAHITHA (JANATHA) KEHELWATTA GAMIDIRIYA SAMAGAMA	PB3243
SEEMASAHITHA (JANATHA) KEMPANAWATTE GEMIDIRIYA SAMAGAMA	PB1135
SEEMASAHITHA (JANATHA) KERADENIYA GEMIDIRIYA SAMAGAMA	PB1219
SEEMASAHITHA (JANATHA) KETAKALLAGAMA GAMIDIRIYA SAMAGAMA	PB1224
SEEMASAHITHA (JANATHA) KETEPOLAKANDA UTHURA GAMIDIRIYA SAMAGAMA	PB3389
SEEMASAHITHA (JANATHA) KIMBULAWELA GAMIDIRIYA SAMAGAMA	PB1281
SEEMASAHITHA (JANATHA) KIRAWANAGAMA GAMIDIRIYA SAMAGAMA (NEPV 619)	PB1584
SEEMASAHITHA (JANATHA) KIRINDA GAMIDIRIYA SAMAGAMA	PB3446
SEEMASAHITHA (JANATHA) KITHULGAHA ARAVA GAMIDIRIYA SAMAGAMA	PB1401
SEEMASAHITHA (JANATHA) KITHULWATTA GAMIDIRIYA SAMAGAMA (NEPV 519)	PB1562
SEEMASAHITHA (JANATHA) KIWULEARA GEMIDIRIYA SAMAGAMA	PB3135
SEEMASAHITHA (JANATHA) KODAKUMBURA GAMIDIRIYA SAMAGAMA	PB3451
SEEMASAHITHA (JANATHA) KODAYANA GAMIDIRIYA SAMAGAMA(NEPV (P) 668)	PB1354
SEEMASAHITHA (JANATHA) KOHILEGAMA GAMIDIRIYA SAMAGAMA (NEPV 315)	PB1495
SEEMASAHITHA (JANATHA) KOLABEWA GAMIDIRIYA SAMAGAMA	PB1776
SEEMASAHITHA (JANATHA) KOLAMBAGAMA AMUNAIDDARA GAMIDIRIYA SAMAGAMA	PB3184
SEEMASAHITHA (JANATHA) KOLAMBAGAMA DAMMORUWA GAMIDIRIYA SAMAGAMA	PB3177
SEEMASAHITHA (JANATHA) KOLLADENIYA GAMIDIRIYA SAMAGAMA (NEPV 292)	PB1809
SEEMASAHITHA (JANATHA) KOLONGASTENNA GAMIDIRIYA SAMAGAMA	PB1318
SEEMASAHITHA (JANATHA) KOLONWINNA GAMIDIRIYA SAMAGAMA	PB3136
SEEMASAHITHA (JANATHA) KONGASTENNNA GAMIDIRIYA SAMAGAMA	PB3141
SEEMASAHITHA (JANATHA) KONGOLLA GAMIDIRIYA SAMAGAMA	PB3083
SEEMASAHITHA (JANATHA) KONKARAHENA GAMIDIRIYA SAMAGAMA	PB1052
SEEMASAHITHA (JANATHA) KOORAGAMMANA GAMIDIRIYA SAMAGAMA	PB1162
SEEMASAHITHA (JANATHA) KOSGAHAGODA GAMIDIRIYS SAMAGAMA (NEPV 722)	PB1524
SEEMASAHITHA (JANATHA) KOSWATTA ARUNODAYA GAMIDIRIYA SAMAGAMA	PB3395
SEEMASAHITHA (JANATHA) KOTABAKMA GAMIDIRIYA SAMAGAMA	PB1778
SEEMASAHITHA (JANATHA) KOTAKETHANA GAMIDIRIIYA SAMAGAMA (NEPV 790)	PB1644
SEEMASAHITHA (JANATHA) KOTAPALLA GAMIDIRIYA SAMAGAMA	PB3377
SEEMASAHITHA (JANATHA) KOTIGALHELA GAMIDIRIYA SAMAGAMA	PB3220
SEEMASAHITHA (JANATHA) KOTIYAGODA GAMIDIRIYA SAMAGAMA (NEPV666)	PB1368
SEEMASAHITHA (JANATHA) KOTTALA -GANGODA GAMIDIRIYA SAMAGAMA	PB3232
SEEMASAHITHA (JANATHA) KOTTALA EKAMUTHU GAMIDIRIYA SAMAGAMA	PB3075
SEEMASAHITHA (JANATHA) KUDABEDIGAMA GAMIDIRIYA SAMAGAMA	PB1054
SEEMASAHITHA (JANATHA) KUDAGALARA SHAKTHI GAMIDIRIYA SAMAGAMA	PB1226
SEEMASAHITHA (JANATHA) KUDAGODA BATAHIRA GAMIDIRIIYA SAMAGAMA	PB3369
SEEMASAHITHA (JANATHA) KUDAGODA NEGENEHIRA GAMIDIDRIYA SAMAGAMA	PB3342
SEEMASAHITHA (JANATHA) KUDALUNUKA GAMIDIRIYA SAMAGAMA	PB1093
SEEMASAHITHA (JANATHA) KUDAOYA GAMIDIRIYA SAMAGAMA	PB1111
SEEMASAHITHA (JANATHA) KUDAWA HELAKANDA GAMIDIRIYA SAMAGAMA	PB1081
SEEMASAHITHA (JANATHA) KUDAWA POLWATTA GAMIDIRIYA SAMAGAMA	PB1267
SEEMASAHITHA (JANATHA) KUDAWA WELIKUMBURA GEMIDIRIYA SAMAGAMA	PB949
SEEMASAHITHA (JANATHA) KUDAWELLA GAMIDIRIYA SAMAGAMA	PB3121
SEEMASAHITHA (JANATHA) KUDU MOHUWELA GAMADIRIYA SAMAGAMA (NEPV 370)	PB1580
SEEMASAHITHA (JANATHA) KUKURUMANGODA GEMIDIRIYA SAMAGAMA	PB3127
SEEMASAHITHA (JANATHA) KURITITENNA GAMIDIRIYA SAMAGAMA (NEPV 183)	PB1814
SEEMASAHITHA (JANATHA) KURUDUGOLLA GEMIDIRIYA SAMAGAMA	PB3472
SEEMASAHITHA (JANATHA) KURUGAMA DAKUNA GAMIDIRIYA SAMAGAMA	PB1138
SEEMASAHITHA (JANATHA) KURUGAMA VISARIELLA GEMIDIRIYA SAMAGAMA	PB667
SEEMASAHITHA (JANATHA) KURUKUDEGAMA GAMIDIRIYA SAMAGAMA	PB3208
SEEMASAHITHA (JANATHA) KURUPANAVILA GAMIDIRIYA SAMAGAMA	PB3346
SEEMASAHITHA (JANATHA) KUTTAPITIYA IHALA GAMIDIRIYA SAMAGAMA	PB608
SEEMASAHITHA (JANATHA) LALPE GAMIDIRIYA SAMAGAMA	PB577
SEEMASAHITHA (JANATHA) LANDEGAMA GAMIDIRIYA SAMAGAMA	PB387
SEEMASAHITHA (JANATHA) LIYANAGAMAKANDA GAMIDIRIYA SAMAGAMA	PB927
SEEMASAHITHA (JANATHA) MADAMPE DAKUNA GAMIDIRIYA SAMAGAMA	PB3050
SEEMASAHITHA (JANATHA) MADAWALALANDA GAMIDIRIYA SAMAGAMA	PB3020
SEEMASAHITHA (JANATHA) MADAWELA BATAHIRA GAMIDIRIYA SAMAGAMA	PB3419
SEEMASAHITHA (JANATHA) MADDETHALAWA GAMIDIRIYA SAMAGAMA	PB3350
SEEMASAHITHA (JANATHA) MADIYAGOLLA GAMIDIRIYA SAMAGAMA (NEPV 589)	PB1708
SEEMASAHITHA (JANATHA) MADURAGAMA EKAMUTHU GAMIDIRIYA SAMAGAMA	PB3526
SEEMASAHITHA (JANATHA) MAHAARA GAMIDIRIYA SAMAGAMA	PB3325
SEEMASAHITHA (JANATHA) MAHADAMANA DAKUNA GAMIDIRIYA SAMAGAMA	PB3510
SEEMASAHITHA (JANATHA) MAHADAMANA PERAMAGA GAMIDIRIYA SAMAGAMA	PB3509
SEEMASAHITHA (JANATHA) MAHAHEELA UTURA GAMIDIRIYA SAMAGAMA (NEPV 755)	PB1663
SEEMASAHITHA (JANATHA) MAHALANDA GAMIDIRIIYA SAMAGAMA (NEPV 428)	PB1699
SEEMASAHITHA (JANATHA) MAHAWELIKADAARA GAMIDIRIYA SAMAGAMA	PB3311
SEEMASAHITHA (JANATHA) MAKANDURA BATAHIRA GAMIDIRIYA SAMAGAMA (NEPV508)	PB1748
SEEMASAHITHA (JANATHA) MAKULLA GAMIDIRIYA SAMAGAMA (NEPV 699)	PB1758
SEEMASAHITHA (JANATHA) MALIGATENNA SHAKTHI GAMIDIRIYA SAMAGAMA	PB3459
SEEMASAHITHA (JANATHA) MALIGATHENNA GAMIDIRIYA SAMAGAMA	PB912
SEEMASAHITHA (JANATHA) MALMEEKANDA GAMIDIRIYA SAMGAMA	PB3363
SEEMASAHITHA (JANATHA) MALPOTHA GAMIDIRIYA SAMAGAMA	PB1076
SEEMASAHITHA (JANATHA) MARAPANA GAMIDIRIYA SAMAGAMA (NEPV 352)	PB1741
SEEMASAHITHA (JANATHA) MARAPANA SIKARADENIYA GAMIDIRIYA SAMAGAMA (NEPV 218)	PB1769
SEEMASAHITHA (JANATHA) MARIARAWA GAMIDIRIYA SAMAGAMA (NEPV 580)	PB1744
SEEMASAHITHA (JANATHA) MASIMBULA EKAMUTHU GAMIDIRIYA SAMAGAMA	PB3105
SEEMASAHITHA (JANATHA) MASIMBULA PRAGATI GAMIDIRIYA SAMAGAMA	PB3090
SEEMASAHITHA (JANATHA) MASIMBULA SAMAGI GAMIDIRIYA SAMAGAMA	PB3239
SEEMASAHITHA (JANATHA) MATIGAHATENNA GAMIDIRIYA SAMAGAMA	PB3248
SEEMASAHITHA (JANATHA) MAWALGAHA GAMIDIRIYA SAMAGAMA	PB3353
SEEMASAHITHA (JANATHA) MAWATALANDA GAMIDIRIYA SAMAGAMA	PB3052
SEEMASAHITHA (JANATHA) MAYURAGAMA GAMIDIRIYA SAMAGAMA (NEPV (P) 642)	PB1362
SEEMASAHITHA (JANATHA) MEDAARA GAMIDIRIYA SAMAGAMA	PB519
SEEMASAHITHA (JANATHA) MEDAGAMA GAMIDIRIYA SAMAGAMA	PB534
SEEMASAHITHA (JANATHA) MEDAGODA GAMIDIRIYA SAMAGAMA (NEPV 718)	PB1668
SEEMASAHITHA (JANATHA) MEDAGODA SHAKTHI GAMIDIRIYA SAMAGAMA	PB3022
SEEMASAHITHA (JANATHA) MEDAPITIYA GAMIDIRIYA SAMAGAMA	PB3154
SEEMASAHITHA (JANATHA) MEDAWELA GAMIDIRIYA SAMAGAMA (NEPV 558)	PB1800
SEEMASAHITHA (JANATHA) MEDAYAYA GAMIDIRIYA SAMAGAMA (NEPV 743)	PB1629
SEEMASAHITHA (JANATHA) MEDIPOKUNA GAMIDIRIYA SAMAGAMA	PB3438
SEEMASAHITHA (JANATHA) MEEGASARA GAMIDIRIYA SAMAGAMA (NEPV 697)	PB1793
SEEMASAHITHA (JANATHA) MEEGASDENIYA GAMIDIRIYA SAMAGAMA	PB3345
SEEMASAHITHA (JANATHA) MEEGASWEWA GAMIDIRIYA SAMAGAMA	PB3456
SEEMASAHITHA (JANATHA) MEEMANAKOLADENIYA GAMIDIRIYA SAMAGAMA	PB3336
SEEMASAHITHA (JANATHA) MENERIPITIYA GAMIDIRIYA SAMAGAMA (NEPV 310)	PB1522
SEEMASAHITHA (JANATHA) MENERIPITIYA GEMIDIRIYA SAMAGAMA	PB718
SEEMASAHITHA (JANATHA) MIHINDU GAMIDIRIYA SAMAGAMA	PB1342
SEEMASAHITHA (JANATHA) MILLABEDDA GAMIDIRIYA SAMAGAMA	PB3126
SEEMASAHITHA (JANATHA) MILLATHEWA GAMIDIRIYA SAMAGAMA	PB3159
SEEMASAHITHA (JANATHA) MINIHIRIGAMA GAMIDIRIYA SAMAGAMA	PB3517
SEEMASAHITHA (JANATHA) MIRISWATTA GAMIDIRIYA SAMAGAMA	PB895
