name	registration_no
SEEMASAHITHA (JANATHA) MIYAGALA GAMIDIRIYA SAMAGAMA (N(EPV) 635)	PB1404
SEEMASAHITHA (JANATHA) MIYANADENIYA GAMIDIRIYA SAMAGAMA	PB1036
SEEMASAHITHA (JANATHA) MORAKANDEGODA GEMIDIRIYA SAMAGAMA	PB968
SEEMASAHITHA (JANATHA) MORAKETIYA GAMIDIRIYA SAMAGAMA	PB1188
SEEMASAHITHA (JANATHA) MORETOTA GAMIDIRIYA SAMAGAMA	PB3217
SEEMASAHITHA (JANATHA) MOROGASWEWA GAMIDIRIYA SAMAGAMA	PB3521
SEEMASAHITHA (JANATHA) MUDANNAWA GAMIDIRIYA SAMGAMA (NEPV 451)	PB1768
SEEMASAHITHA (JANATHA) MUDIYALA GAMIDIRIYA SAMAGAMA	PB3155
SEEMASAHITHA (JANATHA) MURUTHAWELA IHALA GAMIDIRIYA SAMAGAMA	PB1292
SEEMASAHITHA (JANATHA) MUTHUKANDIYA GAMIDIRIYA SAMAGAMA (NEPV671)	PB1390
SEEMASAHITHA (JANATHA) NALAGAMA BATAHIRA GAMIDIRIYA SAMAGAMA	PB3026
SEEMASAHITHA (JANATHA) NALUWELA GAMIDIRIYA SAMAGAMA	PB3348
SEEMASAHITHA (JANATHA) NAMADAGASWEWA NAVODA GAMIDIRIYA SAMAGAMA	PB3319
SEEMASAHITHA (JANATHA) NAMALOYA JANAPADAYA GAMIDIRIYA SAMAGAMA	PB1284
SEEMASAHITHA (JANATHA) NANDANAGAMA GAMIDIRIYA SAMAGAMA	PB3238
SEEMASAHITHA (JANATHA) NARALA GAMIDIRIYA SAMAGAMA (NEPV 576)	PB1807
SEEMASAHITHA (JANATHA) NATHUWALA GEMIDIRIYA SAMAGAMA	PB987
SEEMASAHITHA (JANATHA) NEGENAHIRA MIYANAWITA GAMDIRIYA SAMAGAMA	PB3499
SEEMASAHITHA (JANATHA) NEGENAHIRU SIYABALAGASWADIYA GAMIDIRIYA SAMAGAMA (NEPV 207)	PB1782
SEEMASAHITHA (JANATHA) NELUMWEWA GAMIDIRIYA SAMAGAMA	PB3511
SEEMASAHITHA (JANATHA) NELUWAGALA SASIRI GAMIDIRIYA SAMAGAMA	PB1171
SEEMASAHITHA (JANATHA) NIDAHAS RUVINGAMA GAMIDIRIYA SAMAGAMA	PB3132
SEEMASAHITHA (JANATHA) NIHILUWA BATAHIRA GAMIDIRIYA SAMGAMA (NEPV715)	PB1531
SEEMASAHITHA (JANATHA) NIHILUWA NEGENAHIRA GAMIDIRIYA SAMGAMA (NEPV719)	PB1529
SEEMASAHITHA (JANATHA) NIKAGODA GAMIDIRIYA SAMAGAMA	PB3398
SEEMASAHITHA (JANATHA) NIKEBEDDA PAHALA GAMIDIRIYA SAMAGAMA	PB3408
SEEMASAHITHA (JANATHA) NIRIELLA NEGENAHIRA GAMIDIRIYA SAMAGAMA	PB3197
SEEMASAHITHA (JANATHA) NIVASA HA JEEVANOPAYA SANWARDANA SAMAGAMA	PB1112
SEEMASAHITHA (JANATHA) NORAGALLA GAMIDIRIYA SAMAGAMA	PB3274
SEEMASAHITHA (JANATHA) NUGAWELA GAMIDIRIYA SAMAGAMA (NEPV 720)	PB1669
SEEMASAHITHA (JANATHA) OLD FACTORY GEMIDIRIYA SAMAGMA	PB3242
SEEMASAHITHA (JANATHA) OLUARA GAMIDIRIYA SAMAGAMA (NEPV 550)	PB1746
SEEMASAHITHA (JANATHA) OORALA PAHALA GAMIDIRIIYA SAMAGAMA (NEPV 592)	PB1696
SEEMASAHITHA (JANATHA) OORUPALEWWA GAMIDIRIYA SAMAGAMA	PB1035
SEEMASAHITHA (JANATHA) ORUBENDIWEWA GAMIDIRIIYA SAMAGAMA (NEPV 239)	PB1697
SEEMASAHITHA (JANATHA) PAGURA GAMIDIRIYA SAMAGAMA (NEPV 615)	PB1710
SEEMASAHITHA (JANATHA) PAHALA HAKAMUWA GAMIDIRIYA SAMAGAMA	PB1131
SEEMASAHITHA (JANATHA) PAHALA HAKAMUWA NAWA JANAPADAYA GEMIDIRIYA SAMAGAMA	PB1049
SEEMASAHITHA (JANATHA) PAHALA HAKAMUWA NAWAJANAPADAYA GAMIDIRIYA SAMAGAMA(NEPV (P) 220)	PB1049
SEEMASAHITHA (JANATHA) PAHALA KURUWITA GAMIDIRIYA SAMAGAMA	PB403
SEEMASAHITHA (JANATHA) PAHALAGODA GAMIDIRIYA SAMAGAMA (NEPV 733)	PB1665
SEEMASAHITHA (JANATHA) PAHALAKARAVITA MIYANAKOLAHENYAYA GAMIDIRIYA SAMAGAMA	PB3183
SEEMASAHITHA (JANATHA) PAHALAOBADA GAMIDIRIYA SAMAGAMA (NEPV 627)	PB1747
SEEMASAHITHA (JANATHA) PAHALAOYAGAMA GAMIDIRIYA SAMAGAMA	PB1264
SEEMASAHITHA (JANATHA) PAHANWELA BATAHIRA SHAKTHI GAMIDIRIYA SAMAGAMA	PB1179
SEEMASAHITHA (JANATHA) PAHATAARAWA GAMIDIRIYA SAMAGAMA (N(EPV) 280)	PB1407
SEEMASAHITHA (JANATHA) PALATUDUEWA GAMIDIRIYA SAMAGAMA	PB3040
SEEMASAHITHA (JANATHA) PALLE JULAMPITIYA GAMIDIRIYA SAMAGMA	PB1044
SEEMASAHITHA (JANATHA) PALLEWAVTA GAMIDIRIYA SAMAGAMA	PB1295
SEEMASAHITHA (JANATHA) PALLEWELAGAMA GAMIDIRIYA SAMAGAMA	PB3045
SEEMASAHITHA (JANATHA) PANAGODA GAMIDIRIYA SAMAGAMA	PB1262
SEEMASAHITHA (JANATHA) PANAHETAGALA GAMIDIRIYA SAMAGAMA	PB1058
SEEMASAHITHA (JANATHA) PANAMULLA GAMIDIRIYA SAMAGAMA (PEOPLES)	PB911
SEEMASAHITHA (JANATHA) PANANWELA NEGENAHIRA GAMIDIRIYA SAMAGAMA	PB1160
SEEMASAHITHA (JANATHA) PANGUWA GAMIDIRIYA SAMAGAMA	PB1126
SEEMASAHITHA (JANATHA) PANNILA GAMIDIRIYA SAMAGAMA	PB3251
SEEMASAHITHA (JANATHA) PARAGALA GAMIDIRIYA SAMAGAMA	PB3373
SEEMASAHITHA (JANATHA) PATAKADA NEGENAHIRA GAMIDIRIYA SAMAGAMA	PB3161
SEEMASAHITHA (JANATHA) PATTIYAWELA GAMIDIRIYA SAMAGAMA(NEPV (P) 713)	PB1346
SEEMASAHITHA (JANATHA) PELWATTA NEGENAHIRA GAMIDIRIYA SAMAGAMA	PB838
SEEMASAHITHA (JANATHA) PERAHETTIYA GAMIDIRIYA SAMAGAMA (NEPV 199)	PB1787
SEEMASAHITHA (JANATHA) PERUGAHA ARWA GAMIDIRIYA SAMAGAMA	PB3378
SEEMASAHITHA (JANATHA) PETHIYAGODA GAMIDIRIYASAMAGAMA (NEPV 511)	PB1705
SEEMASAHITHA (JANATHA) PHALAWATTA GAMIDIRIYA SAMAGAMA	PB1072
SEEMASAHITHA (JANATHA) PINNAGOLLA GAMIDIRIYA SAMAGAMA (NEPV 202)	PB1798
SEEMASAHITHA (JANATHA) PISSUBEDDA GEMIDIRIYA SAMAGAMA	PB1082
SEEMASAHITHA (JANATHA) PITAKANDA GAMIDIRIYA SAMAGAMA	PB1268
SEEMASAHITHA (JANATHA) PITAKANDA MANIKDOLA GAMIDIRIYA SAMAGAMA (NEPV 234)	PB1785
SEEMASAHITHA (JANATHA) PITAKUMBURA GAMIDIRIYA SAMAGAMA	PB3149
SEEMASAHITHA (JANATHA) PITAPOLA GAMIDIRIIYA SAMAGAMA (NEPV 560)	PB1693
SEEMASAHITHA (JANATHA) PITIYAKUMBURA GAMIDIRIIYA SAMAGAMA	PB1687
SEEMASAHITHA (JANATHA) PODDANA PAHALA GAMIDIRIYA SAMAGAMA	PB3237
SEEMASAHITHA (JANATHA) PODDANA PAHALA GEMIDIRIYA SAMAGAMA	PB2337
SEEMASAHITHA (JANATHA) PODDANA PITAKANDA GEMIDIRIYA SAMAGAMA	PB3270
SEEMASAHITHA (JANATHA) POLGAHAGAMA GAMIDIRIYA SAMAGAMA (NEPV 189)	PB1725
SEEMASAHITHA (JANATHA) POLOMMARUWA DAKUNA GAMIDIRIYA SAMAGAMA	PB3093
SEEMASAHITHA (JANATHA) PORONUWA GAMIDIRIYA SAMAGAMA (NEPV 384)	PB1454
SEEMASAHITHA (JANATHA) PUBBARA GAMIDIRIYA SAMAGAMA	PB3064
SEEMASAHITHA (JANATHA) PUWAKGASARA GAMIDIRIYA SAMAGAMA (NEPV 214)	PB1812
SEEMASAHITHA (JANATHA) RADANIARA GEMIDIRIYA SAMAGAMA	PB1133
SEEMASAHITHA (JANATHA) RALUWA GAMIDIRIYA SAMAGAMA (NEPV 414)	PB1794
SEEMASAHITHA (JANATHA) RAMBUKA DEDUNU GAMIDIRIYA SAMAGAMA	PB3393
SEEMASAHITHA (JANATHA) RANASINGHEGAMA GAMIDIRIYA SAMAGAMA	PB3524
SEEMASAHITHA (JANATHA) RANDENIYA GEMIDIRIYA SAMAGAMA	PB994
SEEMASAHITHA (JANATHA) RANHAWADIGAMA GAMIDIRIYA SAMAGAMA	PB3453
SEEMASAHITHA (JANATHA) RANMUDUWEWA SWA SHAKTHI GAMIDIRIYA SAMAGAMA	PB3331
SEEMASAHITHA (JANATHA) RANWANGUHAWA GEMIDIRIYA SAMAGAMA	PB603
SEEMASAHITHA (JANATHA) RATHAMBALAKETIYA GAMIDIRIYA SAMAGAMA	PB873
SEEMASAHITHA (JANATHA) RATHMALWALA GAMIDIRIYA SAMAGAMA	PB580
SEEMASAHITHA (JANATHA) RITIGAHAARAWA GAMIDIRIYA SAMAGAMA (NEPV 240)	PB1681
SEEMASAHITHA (JANATHA) RITIGAHAYAYA GAMIDIRIYA SAMAGAMA	PB3334
SEEMASAHITHA (JANATHA) ROTALAWELA GAMIDIRIYA SAMAGAMA (NEPV 738)	PB1511
SEEMASAHITHA (JANATHA) RUKMALPITIYA GAMIDIRIYA SAMAGAMA	PB3338
SEEMASAHITHA (JANATHA) RUWANGAMA GAMIDIRIYA SAMAGAMA (NEPV 210)	PB1781
SEEMASAHITHA (JANATHA) SAMAGIPURA EKAMUTHU GAMIDIRIYA SAMAGAMA	PB3316
SEEMASAHITHA (JANATHA) SAMAGIPURA GAMIDIRIYA SAMAGAMA	PB654
SEEMASAHITHA (JANATHA) SAMAJAPURA SAMGI GAMIDIRIYA SAMAGAMA	PB3329
SEEMASAHITHA (JANATHA) SAMANALABEDDA GAMIDIRIYA SAMAGAMA (N(EPV)(P) 651)	PB1365
SEEMASAHITHA (JANATHA) SANGABOPURA GAMIDIRIIYA SAMAGAMA (NEPV 459)	PB1700
SEEMASAHITHA (JANATHA) SAPUGAHAYA GAMIDIRIIYA SAMAGAMA (NEPV 211)	PB1684
SEEMASAHITHA (JANATHA) SAPUGAHAYAYA LABUHENGODA SITHUMINA GAMIDIRIYA SAMAGAMA	PB1333
SEEMASAHITHA (JANATHA) SENANIGAMA GAMIDIRIYA SAMAGAMA (NEPV 739)	PB1766
SEEMASAHITHA (JANATHA) SENPATHIYA GAMIDIRIYA SAMAGAMA	PB3102
SEEMASAHITHA (JANATHA) SERANA DAKUNA GAMIDIRIYA SAMAGAMA	PB1113
SEEMASAHITHA (JANATHA) SERANA UTHURA GAMIDIRIYA SAMAGAMA	PB1114
SEEMASAHITHA (JANATHA) SHANTHA JAMES WATTA GAMIDIRIYA SAMAGAMA	PB3213
SEEMASAHITHA (JANATHA) SHANTHIPURA DAKSHINA LANKA GAMIDIRIYA SAMAGAMA	PB3532
SEEMASAHITHA (JANATHA) SHANTHIPURA GAMIDIRIYA SAMAGAMA	PB3512
SEEMASAHITHA (JANATHA) SIRILPURA GAMIDIRIYA SAMAGAMA	PB3306
SEEMASAHITHA (JANATHA) SIRIPURAGAMA GAMIDIRIYA JANATHA SAMAGAMA	PB1420
SEEMASAHITHA (JANATHA) SITINAMALUWA BATAHIRA GAMIDIRIYA SAMAGAMA (NEPV (P) 716)	PB1347
SEEMASAHITHA (JANATHA) SIYABHALAGUNAYA GAMIDIRIYA SAMAGAMA	PB666
SEEMASAHITHA (JANATHA) SUDARSHANAGAMA RUHUNU GAMIDIRIYA SAMAGAMA	PB3025
SEEMASAHITHA (JANATHA) SURIYAKANDA GAMIDIRIYA SAMAGAMA	PB3227
SEEMASAHITHA (JANATHA) SURIYAPOKUNA GAMIDIRIIYA SAMAGAMA (NEPV 241)	PB1701
SEEMASAHITHA (JANATHA) SURIYAYAYA GAMIDIRIYA SAMAGAMA	PB3307
SEEMASAHITHA (JANATHA) SWINTON GAMIDIRIYA SAMAGAMA	PB3244
SEEMASAHITHA (JANATHA) TALANGAMUWA GAMIDIRIYA SAMGAMA (NEPV742)	PB1532
SEEMASAHITHA (JANATHA) TALAWA DAKUNA GAMIDIRIYA SAMAGAMA	PB3060
SEEMASAHITHA (JANATHA) TALUNNA GAMIDIRIYA SAMAGAMA	PB3091
SEEMASAHITHA (JANATHA) TENNAHENA GAMIDIRIYA SAMAGAMA	PB1285
SEEMASAHITHA (JANATHA) TENNUGE GAMIDIRIYA SAMAGAMA	PB3458
SEEMASAHITHA (JANATHA) THALAPATHKANDA GEMIDIRIYA SAMAGAMA	PB993
SEEMASAHITHA (JANATHA) THALAVITIYA EGODA GEMIDIRIYA SAMAGAMA	PB380
SEEMASAHITHA (JANATHA) THALAWAGAMA GAMIDIRIYA SAMAGAMA	PB688
SEEMASAHITHA (JANATHA) THAMPALAWELA GAMIDIRIYA SAMAGAMA (NEPV 660)	PB1717
SEEMASAHITHA (JANATHA) THAWALANTENNA GAMIDIRIYASAMAGAMA (NEPV 369)	PB1706
SEEMASAHITHA (JANATHA) THELULLA GAMIDIRIYA SAMAGAMA	PB604
SEEMASAHITHA (JANATHA) THEPPANAWA IHALAGAMA GAMIDIRIYA SAMAGAMA	PB1064
SEEMASAHITHA (JANATHA) THIRAWALA EKSATH GAMIDIRIYA SAMAGAMA	PB555
SEEMASAHITHA (JANATHA) THISEKA SINHAGAMA GAMIDIRIYA SAMAGAMA	PB3530
SEEMASAHITHA (JANATHA) THITHTHAWALKIVELA GAMIDIRIYA SAMAGAMA	PB3081
SEEMASAHITHA (JANATHA) THOLABOWATTA IHALA GAMIDIRIYA SAMAGAMA	PB3381
SEEMASAHITHA (JANATHA) THUNWANA GAMMMANAYA GAMIDIRIYA SAMAGAMA (NEPV653)	PB1379
SEEMASAHITHA (JANATHA) TOTILLAKETIYA GAMIDIRIYA SAMAGAMA	PB3219
SEEMASAHITHA (JANATHA) UDA RANWALA GAMIDIRIYA SAMAGAMA	PB3032
SEEMASAHITHA (JANATHA) UDAALUPOTHDENIYA GAMIDIRIYA SAMAGAMA	PB3337
SEEMASAHITHA (JANATHA) UDAARAWA GEMIIRIYA SAMAGAMA	PB967
SEEMASAHITHA (JANATHA) UDADOMPE GEMIDIRIYA SAMAGAMA	PB3206
SEEMASAHITHA (JANATHA) UDAGALA MADANAGODA GAMIDIRIYA SAMAGAMA (NEPV 297)	PB1775
SEEMASAHITHA (JANATHA) UDAGAMA GAMIDIRIYA SAMAGAMA	PB3265
SEEMASAHITHA (JANATHA) UDAGANGODA GAMIDIRIYA SAMAGAMA	PB3085
SEEMASAHITHA (JANATHA) UDAHA PALLAWAKANDA GAMIDIRIYA SAMAGAMA (NEPV 644)	PB1751
SEEMASAHITHA (JANATHA) UDAPERUWA GEMIDIRIYA SAMAGAMA	PB3445
SEEMASAHITHA (JANATHA) UDENIGAMA GAMIDIRIYA SAMAGAMA	PB582
SEEMASAHITHA (JANATHA) UDUPIHILLA GAMIDIRIYA SAMAGAMA	PB3461
SEEMASAHITHA (JANATHA) UDUPILLEGODA BATAHIRA GAMIDIRIYA SAMAGAMA	PB1141
SEEMASAHITHA (JANATHA) UDUPILLEGODA NEGENEHIRA GAMIDIRIYA SAMAGAMA	PB1045
SEEMASAHITHA (JANATHA) UDUTHULA IHALA GAMIDIRIYA SAMAGAMA (NEPV 219)	PB1488
SEEMASAHITHA (JANATHA) UDUWILAGODA GAMIDIRIYA SAMAGAMA	PB3142
SEEMASAHITHA (JANATHA) UKGASHENA SUHADA GAMIDIRIYA SAMAGAMA	PB1145
SEEMASAHITHA (JANATHA) ULUGALA DEVANA PIYAWARA GAMIDIRIYA SAMAGAMA	PB1749
SEEMASAHITHA (JANATHA) ULUGALA PALAMU PIYAWARA GAMIDIRIIYA SAMAGAMA (NEPV 523)	PB1685
SEEMASAHITHA (JANATHA) ULUPITIYA GAMIDIRIYA SAMAGAMA	PB3352
SEEMASAHITHA (JANATHA) URAULA GAMIDIRIYA SAMAGAMA	PB3148
SEEMASAHITHA (JANATHA) USGALA GAMIDIRIYA SAMAGAMA	PB3323
SEEMASAHITHA (JANATHA) UTHURU HANGINKANDA GAMIDIRIYA SAMAGAMA	PB1011
SEEMASAHITHA (JANATHA) UTHURU KATIYAPE GAMIDIRIYA SAMAGAMA (NEPV 256)	PB1607
SEEMASAHITHA (JANATHA) UTHURU PANAPITIYA GAMIDIRIYA SAMAGAMA	PB3501
SEEMASAHITHA (JANATHA) UTHURU WALEBODA GAMIDIRIYA SAMAGAMA	PB3405
SEEMASAHITHA (JANATHA) UVA KOSGAMA GAMIDIRIYA SAMAGAMA	PB3487
SEEMASAHITHA (JANATHA) UVA PALLEWELA GAMIDIRIYASAMAGAMA	PB3474
SEEMASAHITHA (JANATHA) UVA PARANAGAMA APANAYANA NISHPADANA GAMMAANA SAMAGAMA	PB761
SEEMASAHITHA (JANATHA) VARAGAMA GAMIDIRIYA SAMAGAMA (NEPV633)	PB1397
SEEMASAHITHA (JANATHA) VEEGAMUWA NAGENAHIRA GAMIDIRIYA SAMAGAMA	PB3097
SEEMASAHITHA (JANATHA) VIJITHAPURAGAMA GAMIDIRIYA SAMAGAMA (NPEPV654)	PB1396
SEEMASAHITHA (JANATHA) VILPITA NILWALA GAMIDIRIYA SAMAGAMA	PB997
SEEMASAHITHA (JANATHA) VITHANAGAMA GAMIDIRIYA SAMAGAMA (NEPV 246)	PB1816
SEEMASAHITHA (JANATHA) WAGEGODA RANKOTMALUWA GAMIDIRIYA SAMAGAMA	PB3039
SEEMASAHITHA (JANATHA) WAGURUWELA GAMIDIRIYA SAMAGAMA (NEPV193)	PB3859
SEEMASAHITHA (JANATHA) WALAKUMBURA GAMIDIRIYA SAMAGAMA	PB3143
SEEMASAHITHA (JANATHA) WALASGALA GAMIDIRIYA SAMAGAMA (NEPV 745)	PB1640
SEEMASAHITHA (JANATHA) WALHAPUTENNA GAMIDIRIYA SAMAGAMA	PB3488
SEEMASAHITHA (JANATHA) WALHEWAGE AINA GAMIDIRIYA SAMAGAMA	PB591
SEEMASAHITHA (JANATHA) WALIKALA GAMIDIRIYA SAMAGAMA	PB429
SEEMASAHITHA (JANATHA) WAMIURA GAMIDIRIYA SAMAGAMA	PB3173
SEEMASAHITHA (JANATHA) WANNIYAWATTA GAMIDIRIYA SAMAGAMA	PB3182
SEEMASAHITHA (JANATHA) WARAYAYAGAMIDIRIYA SAMAGAMA	PB3063
SEEMASAHITHA (JANATHA) WARIGAMA GAMIDIRIYA SAMAGAMA	PB958
SEEMASAHITHA (JANATHA) WATAGAMUWA GAMIDIRIYA SAMAGAMA	PB3522
SEEMASAHITHA (JANATHA) WATHOGALA GAMIDIRIYA SAMAGAMA	PB925
SEEMASAHITHA (JANATHA) WATTAHENA GAMIDIRIYA SAMAGAMA	PB745
SEEMASAHITHA (JANATHA) WAWEGAMA SAMAGI GEMIDIRIYA SAMAGAMA	PB3473
SEEMASAHITHA (JANATHA) WAYAMBA GAMI NISHPADANA SAMAGAMA	PB848
SEEMASAHITHA (JANATHA) WEDIKACHCHIYA SAMAGIPURA GAMIDIRIYA SAMAGAMA	PB3454
SEEMASAHITHA (JANATHA) WEDIWEWA NGENAHIRU GAMIDIRIYA SAMAGAMA	PB3321
SEEMASAHITHA (JANATHA) WEEDIKANDA GAMIDIRIYA SAMAGAMA (NEPV 610)	PB1565
SEEMASAHITHA (JANATHA) WEEDURUPOLA GAMIDIRIYA SAMAGAMA	PB1279
SEEMASAHITHA (JANATHA) WEHERAGALA GAMIDIRIYA SAMAGAMA	PB1158
SEEMASAHITHA (JANATHA) WELANDAWA GAMIDIRIYA SAMAGAMA (NEPV 559)	PB1430
SEEMASAHITHA (JANATHA) WELANWITA GAMIDIRIYA SAMAGAMA (NEPV 493)	PB1813
SEEMASAHITHA (JANATHA) WELAOYA GEMIDIRIYA SAMAGAMA	PB3007
SEEMASAHITHA (JANATHA) WELEWATUGODA GEMIDIRIYA SAMAGAMA	PB3224
SEEMASAHITHA (JANATHA) WELILARA EKSATH GAMIDIRIYA SAMAGAMA	PB3308
SEEMASAHITHA (JANATHA) WELIMALUWA PAHALA GAMIDIRIYA SAMAGAMA	PB1034
SEEMASAHITHA (JANATHA) WELIULLA GAMIDIRIIYA SAMAGAMA (NEPV 198)	PB1702
SEEMASAHITHA (JANATHA) WELLASSA RANDENIYA GEMIDIRIYA SAMAGAMA	PB1139
SEEMASAHITHA (JANATHA) WELLAWELA GAMIDIRIYA SAMAGAMA	PB438
SEEMASAHITHA (JANATHA) WELPALLEWELA GAMIDIRIIYA SAMAGAMA (NEPV 757)	PB1698
SEEMASAHITHA (JANATHA) WEPASSAWELA BATAHIRA GAMIDIRIYA SAMAGAMA	PB3210
SEEMASAHITHA (JANATHA) WEPATHAIRA BATAHIRA PRAGATHI GAMIDIRIYA SAMAGAMA	PB1175
SEEMASAHITHA (JANATHA) WEPATHAIRA UTURA JAYODA GAMIDIRIYA SAMAGAMA	PB1177
SEEMASAHITHA (JANATHA) WEPESSAWELA NEGENAHIRA GAMIDIRIYA SAMAGAMA	PB3257
SEEMASAHITHA (JANATHA) WERAGODA GAMIDIRIYA SAMAGAMA	PB3199
SEEMASAHITHA (JANATHA) WEVA PEDESA GAMIDIRIYA SAMAGAMA	PB658
SEEMASAHITHA (JANATHA) WEWALKADURA MADYAMA GAMIDIRIYA SAMAGAMA	PB3374
SEEMASAHITHA (JANATHA) WEWATENNA GAMIDIRIYA SAMAGAMA (NEPV 637)	PB1780
SEEMASAHITHA (JANATHA) WEWATENNAGAMA GAMIDIRIYA SAMAGAMA	PB3176
SEEMASAHITHA (JANATHA) WEWELKADURA BATAHIRA GAMIDIRIYA SAMAGMA	PB3375
SEEMASAHITHA (JANATHA) WEWELKADURA NEGENAHIRA GAMIDIRIYA SAMAGAMA	PB3390
SEEMASAHITHA (JANATHA) WIDANA GAMA GAMIDIRIYA SAMAGAMA (NEPV 737)	PB1510
SEEMASAHITHA (JANATHA) WIDANAGAMA IHALA GAMIDIRIYA SAMAGAMA (NEPV 740)	PB1515
SEEMASAHITHA (JANATHA) WIJAYAPURA GAMIDIRIYA SAMAGAMA	PB1328
SEEMASAHITHA (JANATHA) WIJERIYA GAMIDIRIYA SAMAGAMA	PB3228
SEEMASAHITHA (JANATHA) WILWITA BARAHIRA GAMIDIRIYA SAMAGAMA	PB1009
SEEMASAHITHA (JANATHA) YAHALAWELA GAMIDIRIYA SAMAGAMA	PB3241
SEEMASAHITHA (JANATHA) YAKAGLA YAYA 18 GAMIDIRIYA SAMAGAMA(NEPV (P) 470)	PB1359
SEEMASAHITHA (JANATHA) YAKMADITTA GAMIDIRIYA SAMAGAMA	PB3226
SEEMASAHITHA (JANATHA) YAKUNNAWA GAMIDIRIYA SAMAGAMA	PB3079
SEEMASAHITHA (JANATHA) YAKURAWA GAMIDIRIYA SAMAGAMA (NEPV 318)	PB1497
SEEMASAHITHA (JANATHA) YALAGAMUWA GAMIDIRIYA SAMAGAMA	PB3437
SEEMASAHITHA (JANATHA) YATILLATHOTA GAMIDIRIYA SAMAGAMA(NEPV (P) 678)	PB1153
SEEMASAHITHA (JANATHA) YATIPAWWA BATAHIRA GAMIDIRIYA SAMAGAMA	PB884
SEEMASAHITHA (JANATHA)NEGENAHIRA KANUMULDENIYA GAMIDIRIYA SAMAGAMA	PB1022
SEEMASAHITHA (JANATHA)THIMBIRIGASWEWA GEMIDIRIYA SAMAGAMA	PB3520
SEEMASAHITHA (JASNATHA) HALKADALIYA BATAHIRA GAMIDIRIYA SAMAGAMA	PB3170
SEEMASAHITHA (PADGALIKA) MAHANAMA TRADE CENTER	PV7507
SEEMASAHITHA (PAUDGALIKA SOYA BADA IRINGU KRUSHIBHOGA NISHPADANA SAHA ALEVI GOVI SAMAGAMA .	PV3137
SEEMASAHITHA (PAUDGALIKA) MURUTHANGE AUSHADA WAVILY SAMAGAMA	PV20423
SEEMASAHITHA (PAUDGALIKA) SURATHURA DEPALA VELANDA SANGAMAYA	PV16926
SEEMASAHITHA (PUDGALIKA) KALANA DEPALA HAKRUSHI SANWARDHANA SAMAGAMA	PV18471
SEEMASAHITHA (PUDGALIKA) SYNERGY AGRO PRODUCTS SAMAGAMA	PV14079
SEEMASAHITHA 16 PEDESA GAMANEGUMA JANATHA SAMAGAMA	PB3943
SEEMASAHITHA 9JANATHA) KADURUPOKUNA SUGATHA GAMIDIRIYA SAMAGAMA	PB3112
SEEMASAHITHA AADALUGODA GAMANEGUMA JANATHA SAMAGAMA	PB4251
SEEMASAHITHA ABALAWATTA GAMANEGUMA JANATHA SAMAGMA	PB4161
SEEMASAHITHA ABHAYAPURA+E41390 GAMANEGUMA JANATHA SAMAGMA	PB4151
SEEMASAHITHA ADAWATTA GAMANEGUMA JANATHA SAMAGAMA	PB3653
SEEMASAHITHA ADIRIYANWALA GAMANEGUMA JANATHA SAMAGAMA	PB3640
SEEMASAHITHA AGBOPURA SWASHAKTHI GAMANEGUMA JANATHA SAMAGMA	PB4166
SEEMASAHITHA AGBOPURA UTHURA GAMANEGUMA JANATHA SAMAGAMA	PB3949
SEEMASAHITHA AKIRIYA GAMANAGUMA JANATHA SAMAGAMA	PB3702
SEEMASAHITHA ALANKARAPANGUWA GAMANEGUMA JANATHA SAMAGAMA	PB3971
SEEMASAHITHA ALGODA DEEPALOKA GAMANEGUMA JANATHA SAMAGAMA	PB4279
SEEMASAHITHA ALGODA EKAMUTHU GAMANEGUMA JANATHA SAMAGAMA	PB4612
SEEMASAHITHA ALIKUMBULAWA GAMANEGUMA JANATHA SAMAGAMA	PB4196
SEEMASAHITHA ALOKA AYURVEDA PANCHAKARMA	PV72765
SEEMASAHITHA ALUTHOYA DIRIYA SHAKTHI GAMANEGUMA JANATHA SAMAGAMA	PB4839
SEEMASAHITHA ALUTHOYA EKAMUTHU GAMANEGUMA JANATHA SAMAGAMA	PB3911
SEEMASAHITHA ALUTHPARA PERAKUM MAWATHA GAMANEGUMA JANATHA SAMAGAMA	PB4584
SEEMASAHITHA AMANAWALA GAMANEGUMA JANATHA SAMAGAMA	PB4324
SEEMASAHITHA AMANAWALA WEVIYATHALAWA GAMANEGUMA JANATHA SAMAGAMA	PB4428
SEEMASAHITHA AMARATHUNGAMA GAMANEGUMA JANATHA SAMAGAMA	PB3593
SEEMASAHITHA AMBAGASPITIYA PUBUDU GAMANEGUMA JANATHA SAMAGAMA	PB4542
SEEMASAHITHA AMBALAMPITIYA GAMANEGUAMA JANATHA SAMAGAMA	PB4453
SEEMASAHITHA AMBALANGODA MAGEE PRAVAHANA SEVAYA	PB3731
SEEMASAHITHA AMBALIYADDA GAMANEGUAMA JANATHA SAMAGAMA	PB4504
SEEMASAHITHA AMBANELLA GAMANEGUMA JANATHA SAMAGAMA	PB4543
SEEMASAHITHA AMBATENNA BATAHIRA GAMANEGUMA JANATHA SAMAGAMA	PB3714
SEEMASAHITHA AMBATENNA GAMANEGUMA JANATHA SAMAGAMA	PB3693
SEEMASAHITHA AMILAGAMA GAMANEGUMA JANATHA SAMAGAMA	PB4575
SEEMASAHITHA AMUHEINKANDA UTHURA GAMANEGUMA JANATHA SAMAGAMA	PB3634
SEEMASAHITHA ANURADAPURA MAGEE PRAVAHANA SAMAGAMA	PB5120
SEEMASAHITHA ARAKAWILA BARAHIRA GAMANEGUMA JANATHA SAMAGAMA	PB3765
SEEMASAHITHA ARAKAWILA NEGENAHIRA JANATHA SAMAGAMA	PB3767
SEEMASAHITHA ARAMPITIYA GAMANEGUAMA JANATHA SAMAGAMA	PB4503
SEEMASAHITHA ARVAKUMBURA GAMANEGUMA JANATHA SAMAGAMA	PB3654
SEEMASAHITHA ATAMPITIYA WATTA GAMANEGUMA JANATHA SAMAGAMA	PB4389
SEEMASAHITHA ATHALA GAMANEGUMA JANATHA SAMAGAMA	PB4669
SEEMASAHITHA ATHAPATTUGAMA GAMANEGUMA JANATHA SAMAGAMA	PB3594
SEEMASAHITHA ATHUBODE BATAHIRAGAMANEGUMA JANATHA SAMAGAMA	PB4350
SEEMASAHITHA ATHUBODE NEGENAHIRA GAMANEGUMA JANATHA SAMAGAMA	PB4301
SEEMASAHITHA ATHURALIYA EKAMUTHU GRAMEEYA JALAWIDULI PARIBHOGIKA SAMAGAMA	PB4792
SEEMASAHITHA ATTANAGOLLA GAMANEGUAMA JANATHA SAMAGAMA	PB4440
SEEMASAHITHA ATTANAKADAWALA BATAHIRA PUBUDU GAMANEGUMA JANATHA SAMAGAMA	PB4182
SEEMASAHITHA ATTANAYALA BATAHIRA GAMA NEGUMA JANATHA SAMAGAMA	PB3614
SEEMASAHITHA BADULLA MAGEE PRAWAHANA SAMAGAMA	PB3637
SEEMASAHITHA BAHANELLA ARUNALU GAMANEGUMA JANATHA SAMAGAMA	PB4379
SEEMASAHITHA BALANGODA WATAWALA GAMANDGUMA JANATHA SAMAGAMA	PB3906
SEEMASAHITHA BALAWINNA UTHURA GAMANEGUMA JANATHA SAMAGAMA	PB3928
SEEMASAHITHA BAMUNAKOTUWA GAMANEGUMA JANATHA SAMAGAMA	PB4083
SEEMASAHITHA BANDAGIRIYA EKAMUTHU GAMANEGUMA JANATHA SAMAGAMA	PB4585
SEEMASAHITHA BARAHIRA PATHBERIYA IHALA GAMANEGUMA JANATHA SAMAGAMA	PB3658
SEEMASAHITHA BASNAGALA KORAKAHAHEENNA GAMANEGUMA JANATHA SAMAGAMA	PB4572
SEEMASAHITHA BATAHIRA KAHENGAMA METHSEVANA GAMANEGUMA JANATHA SAMAGAMA	PB3645
SEEMASAHITHA BATANGALA AVADHI GAMANEGUMA JANATHA SAMAGAMA	PB4387
SEEMASAHITHA BATANGALA SAMAGI GAMANEGUMA JANATHA SAMAGAMA	PB4593
SEEMASAHITHA BATUGAMMANA GAMANEGUMA JANATHA SAMAGAMA	PB4769
SEEMASAHITHA BAUDDHAPURA GAMANEGUMA JANATHA SAMAGAMA	PB4615
SEEMASAHITHA BEDDAWEWA BATAHIRA RANSILU GAMANEGUMA JANATHA SAMAGAMA	PB4297
SEEMASAHITHA BEDDEWEWA BATAHIRA JAYALANKA GAMANEGUMA JANATHA SAMAGAMA	PB4277
SEEMASAHITHA BEDIGAMTHOTA NIDHANAGAMA GAMANEGUMA JANATHA SAMAGAMA	PB4285
SEEMASAHITHA BEDIGANTHOTA WIDARSHANA GAMANEGUMA JANATHA SAMAGAMA	PB4340
SEEMASAHITHA BELAGANWEWA UTHURA GAMANEGUMA JANATHA SAMAGAMA	PB4061
SEEMASAHITHA BERALIHELA GAMANEGUMA JANATHA SAMAGAMA	PB3963
SEEMASAHITHA BERANNAWA BATAHIRA GAMANEGUMA JANATHA SAMAGAMA	PB4411
SEEMASAHITHA BINNAGAMA GAMANEGUMA JANATHA SAMAGAMA	PB4849
SEEMASAHITHA BISCO	PV60303
SEEMASAHITHA BISOBANDARA SWASHAKTHI GAMANEGUMA JANATHA SAMAGAMA	PB4236
SEEMASAHITHA BODHIMALUWA GAMANEGUMA JANATHA SAMAGAMA	PB3636
SEEMASAHITHA BODHIMALUWA NAMAL GAMANEGUMA JANATHA SAMAGAMA	PB3709
SEEMASAHITHA BOGAMUWA GAMA NEGUMA JANATHA SAMAGAMA	PB3606
SEEMASAHITHA BOLAGANDAWELA GAMANEGUMA JANATHA SAMAGAMA	PB4418
SEEMASAHITHA BOPITIYA RANTHARU GAMANEGUMA JANATHA SAMAGAMA	PB4132
SEEMASAHITHA BORANGJAMUWA GAMANEGUMA JANATHA SAMAGMA	PB4170
SEEMASAHITHA BORAWEWA GAMANEGUMA JANATHA SAMAGAMA	PB4204
SEEMASAHITHA BOSIRIGAMA GAMANEGUMA JANATHA SAMAGAMA	PB4259
SEEMASAHITHA BUBULANDA GAMANEGUMA JANATHA SAMAGAMA	PB4838
SEEMASAHITHA BUDDHIGAMA BATAHIRA GAMANEGUMA JANATHA SAMAGAMA	PB4354
SEEMASAHITHA BULUTHOTA DIRIYA GAMANEGUMA JANATHA SAMAGAMA	PB4106
SEEMASAHITHA BULUWANA 1 GAMANEGUMA JANATHA SAMAGAMA	PB4037
SEEMASAHITHA BULUWANA GAMANEGUMA JANATHA SAMAGAMA	PB4033
SEEMASAHITHA DABAWINNA GAMANEGUMA JANATHA SAMAGAMA	PB3923
SEEMASAHITHA DABBARE GAMANEGUAMA JANATHA SAMAGAMA	PB4490
SEEMASAHITHA DADAYAMKANDA RAJJALAKANDA GAMANEGUMA JANATHA SAMAGAMA	PB4226
SEEMASAHITHA DADUHETHEPMA GAMANEGUMA JANATHA SAMAGAMA	PB4231
SEEMASAHITHA DAHANAGGAMA GAMANEGUMA JANATHA SAMAGAMA	PB4731
SEEMASAHITHA DAMANAYAYA DAMPURA GAMANEGUMA JANATHA SAMAGAMA	PB4184
SEEMASAHITHA DAMANEWEWA GAMANEGUMA JANATHA SAMAGAMA	PB4209
SEEMASAHITHA DAMBADENIYA APANAYANA BHANDA SANWARDANA SAMAGAMA	PB1244
SEEMASAHITHA DAMBAWELA GAMA NEGUMA JANATHA SAMAGAMA	PB3575
SEEMASAHITHA DAMBEGODA GAMANEGUMA JANATHA SAMAGAMA	PB4227
SEEMASAHITHA DAMMULLA BATAHIRA GAMANEGUMA JANATHA SAMAGAMA	PB4066
SEEMASAHITHA DAMWINNA GAMANEGUMA JANATHA SAMAGAMA	PB4084
SEEMASAHITHA DANDENIYAGAMA GAMA NEGUMA JANATHA SAMAGAMA	PB3600
SEEMASAHITHA DANGALA KANDA RANTHARU GAMANEGUMA JANATHA SAMAGAMA	PB4732
SEEMASAHITHA DANGAMPALA GAMANEGUMA JANATHA SAMAGAMA	PB4247
SEEMASAHITHA DAPANE RANMANDAWELA GAMANEGUMA JANATHA SAMAGAMA	PB4005
SEEMASAHITHA DAPANE RUWANKOTHA GAMANEGUMA JANATHA SAMAGAMA	PB4007
SEEMASAHITHA DARGAPURA ISURU GAMANEGUMA JANATHA SAMAGAMA	PB4317
SEEMASAHITHA DEBOKKAWA UTHURA GAMA NEGUMA JANATHA SAMAGAMA	PB3611
SEEMASAHITHA DEDUWAWELA NEGENAHIRA GAMANEGUMA JANATHA SAMAGAMA	PB4067
SEEMASAHITHA DEEPTHIGAMA GAMANEGUMA JANATHA SAMAGAMA	PB4534
SEEMASAHITHA DEHIATTAWALA GAMANEGUMA JANATHA SAMAGAMA	PB4705
SEEMASAHITHA DEHIKINDAGAMA GAMANEGUMA JANATHA SAMAGAMA	PB4733
SEEMASAHITHA DELGAMUWA NEGENAHIRU GAMANEGUMA JANATHA SAMAGAMA	PB3712
SEEMASAHITHA DEMERIYA IRULIYAL GAMANEGUMA JANATHA SAMAGAMA	PB4603
SEEMASAHITHA DEMODARA IHALA GAMANEGUMA JANATHA SAMAGAMA	PB4012
SEEMASAHITHA DERANIYAGALA DAKUNA SATHPURAGAMA GAMANEGUMA JANATHA SAMAGAMA	PB4359
SEEMASAHITHA DEWRAMWEHERA JANAPUBUDU GAMANEGUMA JANATHA SAMAGMA	PB4145
SEEMASAHITHA DIANAWATTA GAMANEGUMA JANATHA SAMAGAMA	PB4696
SEEMASAHITHA DIGGALPURA YAYA HAYA GAMANEGUMA JANATHA SAMAGAMA	PB4743
SEEMASAHITHA DIKDENIYA EKSATH GAMANEGUMA JANATHA SAMAGAMA	PB3717
SEEMASAHITHA DIKELLA GAMANEGUAMA JANATHA SAMAGAMA	PB4451
SEEMASAHITHA DIKELLA MAHAOYA GAMANAEGUMA JANATHA SAMAGAMA	PB4597
SEEMASAHITHA DIKELLA MAHAOYA GAMANEGUMA JANATHA SAMAGAMA	PB4596
SEEMASAHITHA DIKYAYA GAMANEGUMA JANATHA SAMAGAMA	PB4578
SEEMASAHITHA DIMBULAGALA MEDAGAMA GAMANEGUMA JANATHA SAMAGAMA	PB4700
SEEMASAHITHA DIVULAPELESSA IHALA GAMANEGUMA JANATHA SAMAGAMA	PB4274
SEEMASAHITHA DIVULAPELESSA PAHALA GAMANEGUMA JANATHA SAMAGAMA	PB4291
SEEMASAHITHA DIYABEDUMA GAMANEGUMA JANATHA SAMAGAMA	PB4194
SEEMASAHITHA DIYAPOTA GAMANEGUMA JANATHA SAMAGAMA	PB4238
SEEMASAHITHA DIYAVINNA GAMANEGUMA JANATHA SAMAGAMA	PB4052
SEEMASAHITHA DOBEPOLA EKAMUTHU GAMANEGUMA JANATHA SAMAGAMA	PB4258
SEEMASAHITHA DOBEPOLA POONUGALAWATTA GAMANEGUMA JANATHA SAMAGAMA	PB4426
SEEMASAHITHA DODAMPE BATAHIRA EKAMUTHU GAMANEGUMA JANATHA SAMAGAMA	PB3685
SEEMASAHITHA DODAMPE UTHURA SAMAGI GAMANEGUMA JANATHA SAMAGAMA	PB3694
SEEMASAHITHA DODANGASTHALAWA GAMANEGUMA JANATHA SAMAGAMA	PB4567
SEEMASAHITHA DODAWATTA GEDARA GAMANEGUAMA JANATHA SAMAGAMA	PB4481
SEEMASAHITHA DOGALUOYA GRAMEEYA JALA VIDULI SAMAGAMA	PB5279
SEEMASAHITHA DOMBAGAHAWELA PIHILLABEDDA GAMANEGUMA JANATHA SAMAGAMA	PB3724
SEEMASAHITHA DOMBEPOLA ARUNALU GAMANEGUAMA JANATHA SAMAGAMA	PB4448
SEEMASAHITHA DORAPANE KAVULU RANAPIYASA GAMANEGUMA JANATHA SAMAGAMA	PB4114
SEEMASAHITHA DUNUKEDENIGAMA GAMANEGUAMA JANATHA SAMAGAMA	PB4484
SEEMASAHITHA DUNUKEDENIYA SIHASHAKTHI GAMANEGUMA JANATHA SAMAGAMA	PB4308
SEEMASAHITHA DURAKANDA GAMANEGUAMJANATHA SAMAGAMA	PB3933
SEEMASAHITHA DUTUGEMUNUPURA GAMANEGUMA JANATHA SAMAGMA	PB4149
SEEMASAHITHA EKAMUTHUGAMA DAKUNA GAMANEGUMA JANATHA SAMAGA	PB4758
SEEMASAHITHA EKAMUTHUGAMA UTHURA GAMANEGUMA JANATHA SAMAGAMA	PB4647
SEEMASAHITHA ELAHERA+E41435 GAMANEGUMA JANATHA SAMAGAMA	PB4178
SEEMASAHITHA ELAMULLA GAMANEGUMA JANATHA SAMAGMA	PB4164
SEEMASAHITHA ELDORADO GAMANEGUMA JANATHA SAMAGAMA	PB4599
SEEMASAHITHA ELLAWALA PAHALAGAMA UTURA GAMANEGUMA JANATHA SAMAGAMA	PB3687
SEEMASAHITHA ELLEWEWA SHRAMASHAKTHI GAMANEGUMA JANATHA SAMAGAMA	PB4246
SEEMASAHITHA ELLEWEWA SWASHAKTHI GAMANEGUMA JANATHA SAMAGAMA	PB4074
SEEMASAHITHA ELTUB IHALA GAMANEGUMA JANATHA SAMAGAMA	PB4661
SEEMASAHITHA ENVIORONMENT AND CHILDREN RYMES PRESERVATION SAMAGAMA	PB4749
SEEMASAHITHA EPITAWALA GAMANEGUMA JANATHA SAMAGAMA	PB3696
SEEMASAHITHA EPITAWALA NEGENAHIRA GAMANNEGUMA JANATHA SAMAGAMA	PB3757
SEEMASAHITHA GAJANAYAKAGAMA GAMA NEGUMA JANATHA SAMAGAMA	PB3622
SEEMASAHITHA GALAGAMA DAKUNA GAMANEGUMA JANATHA SAMAGAMA	PB4053
SEEMASAHITHA GALKADAWALA GAMANEGUAMA JANATHA SAMAGAMA	PB4457
SEEMASAHITHA GALKETIWELA GAMANEGUMA JANATHA SAMAGAMA	PB4419
SEEMASAHITHA GALLA MATARA DISTRIK GAMANEGUMA EKABADDA SAMAGAMA	PB3871
SEEMASAHITHA GALPORUYAYA GAMANEGUMA JANATHA SAMAGAMA	PB4842
SEEMASAHITHA GALTAMMANDIYA GAMANEGUMA JANATHA SAMAGAMA	PB4423
