name	registration_no
SEEMASAHITHA GALTANHENA GAMANEGUMA JANATHA SAMAGAMA	PB4653
SEEMASAHITHA GALTHALAWA GAMANEGUMA JANATHA SAMAGAMA	PB4086
SEEMASAHITHA GALULLA DUMO GAMANEGUMA JANATHA SAMAGAMA	PB3768
SEEMASAHITHA GAMAELA UTHURA GAMANEGUMA JANATHA SAMAGAMA	PB4318
SEEMASAHITHA GAMAKANDA GAMANEGUMA JANATHA SAMAGAMA	PB4225
SEEMASAHITHA GAMANEGUMA JANATHA SAMAGAMA	PB4685
SEEMASAHITHA GAMISARANI GAMANEGUMA JANATHA SAMAGAMA	PB4338
SEEMASAHITHA GAMMEDAGAMA GAMANEGUMA JANATHA SAMAGAMA	PB3931
SEEMASAHITHA GAMPAHA SIDDHAURVEDA RASAYANAUSHADHA SAMAGAMA	PB31
SEEMASAHITHA GANGODARAVA GAMIDIRIYA SAMAGAMA (NEPV 291)	PB1611
SEEMASAHITHA GATAMANNA NEGENAHIRA GAMANEGUMA JANATHA SAMAGAMA	PB4054
SEEMASAHITHA GELAMULLA GAMANEGUMA JANATHA SAMAGAMA	PB3670
SEEMASAHITHA GODAGAMPOLA GAMANEGUMA JANATHA SAMAGAMA	PB4343
SEEMASAHITHA GODAKUMBURA GAMANEGUMA JANATHA SAMAGAMA	PB3937
SEEMASAHITHA GODAPORUYAYA GAMANEGUMA JANATHA SAMAGMA	PB4156
SEEMASAHITHA GODAUDAWADIYA GAMANEGUMA JANATHA SAMAGAMA	PB4268
SEEMASAHITHA GONAGALA BATAHIRA GAMANEGUMA JANATHA SAMAGAMA	PB3759
SEEMASAHITHA GONAGAMUWA EKAMUTHU GAMANEGUMA JANATHA SAMAGAMA	PB4716
SEEMASAHITHA GONAGAMUWA SAMAGI GAMANEGUMA JANATHA SAMAGMA	PB4747
SEEMASAHITHA GONAKELE PAHALA GAMANEGUMA JANATHA SAMAGAMA	PB4588
SEEMASAHITHA GOVIGEDARA EKABADDA GOVI	PV65462
SEEMASAHITHA GOVUSSA GAMANEGUMA JANATHA SAMAGAMA	PB4016
SEEMASAHITHA GURBEWILA GAMANEGUMA JANATHA SAMAGAMA	PB3999
SEEMASAHITHA GURULUPITIGAMA WELIKANDA GAMANEGUMA JANATHA SAMAGAMA	PB3898
SEEMASAHITHA GURULUWEGAMA GAMANEGUMA JANATHA SAMAGAMA	PB3888
SEEMASAHITHA GURUTHTHEHENA ARA GAMA NEGUMA JANATHA SAMAGAMA	PB3621
SEEMASAHITHA HABARATTAWALA IHALA GAMANEGUMA JANATHA SAMAGAMA	PB4346
SEEMASAHITHA HABARATTAWALA PAHALAGAMA GAMANEGUMA JANATHA SAMAGAMA	PB4283
SEEMASAHITHA HADAGIRIYA GAMANEGUMA JANATHA SAMAGAMA	PB3993
SEEMASAHITHA HADDATHTHAWA GAMANEGUMA JANATHA SAMAGMA	PB4160
SEEMASAHITHA HADDATHTHAWA UTHURA GAMANEGUMA JANATHA SAMAGMA	PB4154
SEEMASAHITHA HAKBELLANA KELENINADEE GAMANEGUMA JANATHA SAMAGAMA	PB4303
SEEMASAHITHA HAKBELLAWAKA BADULLAWALA GAMANEGUMA JANATHA SAMAGAMA	PB4234
SEEMASAHITHA HALMILLWA GAMANEGUMA JANATHA SAMAGAMA	PB4643
SEEMASAHITHA HALWATHURUKANDA SRI WIMALAKITTI EKAMUTHU GAMANEGUMA JANATHA SAMAGAMA	PB3912
SEEMASAHITHA HALWELLA+E41009 GAMANEGUMA JANATHA SAMAGAMA	PB4046
SEEMASAHITHA HARASBEDDA DAKUNA GAMANEGUAMA JANATHA SAMAGAMA	PB4485
SEEMASAHITHA HARITHA KIRULA SAMAGAMA	PB3872
SEEMASAHITHA HEBARAWA GAMANEGUMA JANATHA SAMAGAMA	PB4243
SEEMASAHITHA HELA DHERANA INVESTMENT	PV108493
SEEMASAHITHA HELA PUPULA GAMANEGUMA JANATHA SAMAGAMA	PB4655
SEEMASAHITHA HELARMBA ARUNALU GAMANEGUMA JANATHA SAMAGAMA	PB4233
SEEMASAHITHA HENTENNEGODA GAMANEGUMA JANATHA SAMAGAMA	PB4105
SEEMASAHITHA HETTIYAPOLAGAMA GAMANEGUMA JANATHA SAMAGAMA	PB4676
SEEMASAHITHA HIGURALAKANDA ABHINANDANA GAMANEGUMA JANATHA SAMAGAMA	PB4388
SEEMASAHITHA HINGURALAKANDA BATAHIRA GAMANEGUAMA JANATHA SAMAGAMA	PB4449
SEEMASAHITHA HINGURALAKANDA NEGENAHIRA GAMANEGUAMA JANATHA SAMAGAMA	PB4450
SEEMASAHITHA HOLIPITIYA GAMANEGUMA JANATHA SAMAGAMA	PB3699
SEEMASAHITHA HOMELAND PROPERTY	PV63692
SEEMASAHITHA HOPTON GAMANEGUMA JANATHA SAMAGAMA	PB3682
SEEMASAHITHA HORAKETIYA GAMANEGUMA JANATHA SAMAGAMA	PB3945
SEEMASAHITHA IDAMEGAMA GAMANEGUMA JANATHA SAMAGAMA	PB4090
SEEMASAHITHA IDANGODA BATAHIRA GAMANEGUMA JANATHA SAMAGAMA	PB3688
SEEMASAHITHA IHAKULUWEWA SAMAGI GAMANEGUMA JANATHA SAMAGAMA	PB4183
SEEMASAHITHA IHALA DAIGALA GAMANEGUMA JANATHA SAMAGAMA	PB4341
SEEMASAHITHA IHALA ELLEWEWA KOTMALE GAMANEGUMA JANATHA SAMAGAMA	PB4096
SEEMASAHITHA IHALA IMBULPITIYA GAMANEGUMA JANATHA SAMAGAMA	PB4177
SEEMASAHITHA IHALA POLGASWATTA GAMANEGUAMA JANATHA SAMAGAMA	PB4495
SEEMASAHITHA IHALA RAGEDARA GAMANEGUMA JANATHA SAMAGAMA	PB4620
SEEMASAHITHA ILUMAKANDAMILINDUTALAWA SADAHARITHA GAMANEGUMA JANATHA SAMAGAMA	PB3882
SEEMASAHITHA IMBULAMURA GAMANEGUMA JANATHA SAMAGAMA	PB3916
SEEMASAHITHA IMBULPITIYA GAMANEGUMA JANATHA SAMAGMA	PB4165
SEEMASAHITHA INDIGATAWELA GAMANEGUMA JANATHA SAMAGAMA	PB3676
SEEMASAHITHA INDIGETAWELA GAMANEGUMA JANATHA SAMAGAMA	PB3596
SEEMASAHITHA ITTAKATUWA GAMANEGUMA JANATHA SAMAGA,A	PB3926
SEEMASAHITHA ITTANWEKADA GAMANEGUMA JANATHA SAMAGAMA	PB3961
SEEMASAHITHA JABUREWELA GAMANEGUMA JANATHA SAMAGAMA	PB4187
SEEMASAHITHA JADURA DAKUNA GAMA NEGUMA JANATHA SAMAGAMA	PB3609
SEEMASAHITHA JADURA UTHURA GAMANEGUMA JANATHA SAMAGAMA	PB3592
SEEMASAHITHA JALAMULLA SHAKTHI GAMANEGUMA JANATHA SAMAGAMA	PB3595
SEEMASAHITHA JANADARA KOHOMBADARANA GAMANEGUMA JANATHA SAMAGAMA	PB4332
SEEMASAHITHA JANAPUBUDU GAMANEGUMA JANATHA SAMAGAMA	PB4408
SEEMASAHITHA JANARUKULA (EPA) SAMAGAMA	GL2352
SEEMASAHITHA JANATHA BADULLEGAMA GEMIDIRIYA SAMAGAMA	PB3164
SEEMASAHITHA JANATHA BADULUOYA GEMIDIRIYA SAMAGAMA	PB3053
SEEMASAHITHA JANATHA DALUWAKGODA GEMIDIRIYA SAMAGAMA	PB1216
SEEMASAHITHA JANATHA GALAPITAARA GAMIDIRIIYA SAMAGAMA (NEPV 269)	PB1624
SEEMASAHITHA JANATHA GODUNNA GEMIDIRIYA SAMAGAMA	PB3037
SEEMASAHITHA JANATHA HEENDALUKINNA GEMIDIRIYA SAMAGAMA	PB3078
SEEMASAHITHA JANATHA KAKIRAOBADA GEMIDIRIYA SAMAGAMA	PB1199
SEEMASAHITHA JANATHA KANDAKAPUULPOTHA GEMIDIRIYA SAMAGAMA	PB3096
SEEMASAHITHA JANATHA KANDEARAWA PARAGAHAELLA GEMIDIRIYA SAMAGAMA	PB3116
SEEMASAHITHA JANATHA KARAMATIARA GEMIDIRIYA SAMAGAMA	PB3100
SEEMASAHITHA JANATHA KOMARIKAGAMA GEMIDIRIYA SAMAGAMA	PB3188
SEEMASAHITHA JANATHA KOTTALA SAMAGI GEMIDIRIYA SAMAGAMA	PB3106
SEEMASAHITHA JANATHA MAHAPALESSA GEMIDIRIYA SAMAGAMA	PB3074
SEEMASAHITHA JANATHA MAHATHANNEGAMA GEMIDIRIYA SAMAGAMA	PB3120
SEEMASAHITHA JANATHA MAKANDURA GEMIDIRIYA SAMAGAMA	PB3049
SEEMASAHITHA JANATHA NAVA KATUKALIYAWA GAMIDIRIYA SAMAGAMA	PB3503
SEEMASAHITHA JANATHA UDADELWALA GEMIDIRIYA SAMAGAMA	PB961
SEEMASAHITHA JANATHA WEWELHINNA GEMIDIRIYA SAMAGAMA	PB3166
SEEMASAHITHA JANATHA WIDAPOLA GEMIDIRIYA SAMAGAMA	PB1203
SEEMASAHITHA JANATHA YAKDEHIWATTE GEMIDIRIYA SAMAGAMA	PB3131
SEEMASAHITHA JAYAGAMA GAMANEGUMA JANATHA SAMAGMA	PB4167
SEEMASAHITHA JAYAMUTHUGAMA SAMAGI GAMANEGUMA JANATHA SAMAGAMA	PB4093
SEEMASAHITHA JAYAPURA SWARNASHAKTHI GAMANEGUMA JANATHA SAMAGAMA	PB4136
SEEMASAHITHA JAYASIRIPURA GAMANEGUMA JANATHA SAMAGAMA	PB4191
SEEMASAHITHA JEEWANALEE PRAJA SAHAKARAKA SAMAGAMA	PB5302
SEEMASAHITHA JULAMULLA GAMA NEGUMA JANATHA SAMAGAMA	PB3605
SEEMASAHITHA KABARAGALAMULLA SAMADHI GAMANEGUMA JANATHA SAMAGAMA	PB4840
SEEMASAHITHA KADADORA HOREHEENA GAMANEGUMA JANATHA SAMAGAMA	PB4403
SEEMASAHITHA KADAWATHWADUJ RANMINI GAMANEGUMA JANATHA SAMAGAMA	PB4430
SEEMASAHITHA KAHATAGAHAPITIYA ALOKA GAMANEGUMA JANATHA SAMAGAMA	PB4180
SEEMASAHITHA KAHATAWILA GAMANEGUMA JANATHA SAMAGAMA	PB4102
SEEMASAHITHA KAHAWATTA GAMANEGUMA JANATHA SAMAGAMA	PB4579
SEEMASAHITHA KAHENGAMA NAWA JANAPADAYA GAMANEGUMA JANATHA SAMAGAMA	PB3716
SEEMASAHITHA KALATUWAKANDA GAMANEGUMA JANATHA SAMAGAMA	PB3924
SEEMASAHITHA KALINGAWILA GAMANEGUMA JANATHA SAMAGAMA	PB4207
SEEMASAHITHA KALUGALA GAMANEGUMA JANATHA SAMAGAMA	PB3876
SEEMASAHITHA KALUWAGAHAYAYA GAMANEGUMA JANATHA SAMAGAMA	PB4361
SEEMASAHITHA KAMPANE GAMANEGUMA JANATHA SAMAGAMA	PB4048
SEEMASAHITHA KAMPANE SHAKTHI GAMANEGUMA JANATHA SAMAGAMA	PB4107
SEEMASAHITHA KANAWARELLA GAMANEGUMA JANATHA SAMAGAMA	PB3651
SEEMASAHITHA KANAWARELLAWATTA GAMANEGUMA JANATHA SAMAGAMA	PB4631
SEEMASAHITHA KANDAGASMANKADA JANASHAKTHI GAMANEGUAMJANATHA SAMAGAMA	PB3976
SEEMASAHITHA KANDAPOLA GAMANEGUMA JANATHA SAMAGAMA	PB4602
SEEMASAHITHA KANDEGEDARA GAMANEGUMA JANATHA SAMAGAMA	PB3887
SEEMASAHITHA KANDEYAYA GAMANEGUAMA JANATHA SAMAGAMA	PB4513
SEEMASAHITHA KANUBICHCHIYA GAMANEGUMA JANATHA SAMAGAMA	PB4796
SEEMASAHITHA KAPUWATTA GAMANEGUMA JANATHA SAMAGAMA	PB4208
SEEMASAHITHA KARAGAHAYATATENNA GAMANEGUMA JANATHA SAMAGAMA	PB4568
SEEMASAHITHA KARAMBA WEWA GAMANEGUAMA JANATHA SAMAGAMA	PB4459
SEEMASAHITHA KARANDAGAHAMADA GAMANEGUMA JANATHA SAMAGAMA	PB4276
SEEMASAHITHA KARANDAGOLLA IHALA GAMANEGUMA JANATHA SAMAGAMA	PB4652
SEEMASAHITHA KARANDAGOLLA PAHALA GAMANEGUMA JANATHA SAMAGAMA	PB4608
SEEMASAHITHA KATARAGAMA MAGEE PRAVAHANA SEVAYA	PB3730
SEEMASAHITHA KATHLANA PRAJASHAKTHI GAMANEGUMA JANATHA SAMAGAMA	PB4134
SEEMASAHITHA KATUKEPURAARA SAHASRA GAMANEGUMA JANATHA SAMAGAMA	PB4420
SEEMASAHITHA KATULANDA GAMANEGUMA JANATHA SAMAGAMA	PB4111
SEEMASAHITHA KATUMANA GAMANEGUAMA JANATHA SAMAGAMA	PB4471
SEEMASAHITHA KAUDAWA GAMANEGUMA JANATHA SAMAGAMA	PB4775
SEEMASAHITHA KAWANTISSAPURA GAMANEGUMA JANATHA SAMAGAMA	PB4260
SEEMASAHITHA KEBELLAWITA GAMANEGUMA JANATHA SAMAGMA	PB4172
SEEMASAHITHA KEERAGALAWATTA GAMANEGUMA JANATHA SAMAGAMA	PB3666
SEEMASAHITHA KEKULUWELA GAMANEGUMA JANATHA SAMAGAMA	PB4214
SEEMASAHITHA KELEGAMA GAMANEGUMA JANATHA SAMAGAMA	PB4342
SEEMASAHITHA KELLAGAMA KEHELIYA GAMANEGUMA JANATHA SAMAGAMA	PB4858
SEEMASAHITHA KEMEINITENNA GAMANEGUAMA JANATHA SAMAGAMA	PB4472
SEEMASAHITHA KENDAGASMANKADA NAVODYA GAMANEGUMA JANATHA SAMAGAMA	PB3947
SEEMASAHITHA KENDAWINDA GAMANEGUMA JANATHA SAMAGAMA	PB4674
SEEMASAHITHA KESELPOTHA DAKUNA GAMANEGUMA JANATHA SAMAGAMA	PB4601
SEEMASAHITHA KETAGALARA GAMANEGUMA JANATHA SAMAGAMA	PB4272
SEEMASAHITHA KETAMBULAWA GAMANEGUMA JANATHA SAMAGAMA	PB4569
SEEMASAHITHA KETAMBULAWA NORTH GAMANEGUMA JANATHA SAMAGAMA	PB4667
SEEMASAHITHA KETAWATTA GAMANEGUMA JANATHA SAMAGAMA	PB4275
SEEMASAHITHA KETHSIRIGAMA GAMANEGUMA JANATHA SAMAGAMA	PB4270
SEEMASAHITHA KINNARABOWA GAMANEGUMA JANATHA SAMAGAMA	PB4675
SEEMASAHITHA KIRIKOHUTENNA BATAHENKANDA GAMANEGUMA JANATHA SAMAGAMA	PB4257
SEEMASAHITHA KIRINDIWALA GAMANEGUAMA JANATHA SAMAGAMA	PB4494
SEEMASAHITHA KITHULKELE GAMANEGUMA JANATHA SAMAGAMA	PB4604
SEEMASAHITHA KITHULWEHERA GAMANEGUMA JANATHA SAMAGAMA	PB4103
SEEMASAHITHA KODURUWAWALA GAMANEGUMA JANATHA SAMAGAMA	PB3889
SEEMASAHITHA KOGIYAGALA GAMANEGUMA JANATHA SAMAGAMA	PB3735
SEEMASAHITHA KOHUKUMBURA GAMANEGUMA JANATHA SAMAGAMA	PB4677
SEEMASAHITHA KOKKOWITA SIRISUMEDHA GAMANEGUMA JANATHA SAMAGAMA	PB3635
SEEMASAHITHA KOLONNA YAKMADITTA KRUSHI NISHPADANA	PV64018
SEEMASAHITHA KONGAHAMANKADA DAKUNA GAMANEGUMA JANATHA SAMAGAMA	PB3946
SEEMASAHITHA KONGAHAWATTA GAMNEGUMA JANATHA SAMAGAMA	PB3905
SEEMASAHITHA KONWELANA GAMANEGUMA JANATHA SAMAGAMA	PB4683
SEEMASAHITHA KOORAGALA GAMANEGUMA JANATHA SAMAGAMA	PB3944
SEEMASAHITHA KORADDAEKUMBURA GAMANEGUMA JANATHA SAMAGAMA	PB4029
SEEMASAHITHA KORADDEKUMBURA PAHALA GAMANEGUMA JANATHA SAMAGAMA	PB4028
SEEMASAHITHA KOSGAHAKANDA GAMANEGUMA JANATHA SAMAGAMA	PB4365
SEEMASAHITHA KOSGAHAKANDA VEEDIYAWATTA GAMANEGUMA JANATHA SAMAGAMA	PB4377
SEEMASAHITHA KOSGAHAKANDAGAMA GAMANEGUAMA JANATHA SAMAGAMA	PB4465
SEEMASAHITHA KOSSAKANDA GAMANEGUMA JANATHA SAMAGAMA	PB4307
SEEMASAHITHA KOSSALPALA GAMANEGUMA JANATHA SAMAGAMA	PB4712
SEEMASAHITHA KOTAGODA GAMANEGUMA JANATHA SAMAGAMA	PB3729
SEEMASAHITHA KOTAWEHERA PALUGOLLA GAMANEGUMA JANATHA SAMAGAMA	PB3893
SEEMASAHITHA KOTIYAGALA EKAMUTU GAMANEGUMA JANATHA SAMAGAMA	PB3732
SEEMASAHITHA KUDA NUWARAGALA JANATHA SAMAGAMA	PB4619
SEEMASAHITHA KUDA POKUNA EKAMUTHU GAMANEGUMA JANATHA SAMAGAMA	PB4735
SEEMASAHITHA KUDABUBULA UTHURA GAMANEGUAMA JANATHA SAMAGAMA	PB4475
SEEMASAHITHA KUDAWA ARUNALU GAMANEGUMA JANATHA SAMAGAMA	PB4124
SEEMASAHITHA KUMARAPETTIYA GAMANEGUMA JANATHA SAMAGAMA	PB4228
SEEMASAHITHA KUMBUKWELA GAMANEGUAMA JANATHA SAMAGAMA	PB4445
SEEMASAHITHA KURUNEGALA - MAHANUWARA MAGEE PRAWAHANA SEWAYA	PB3875
SEEMASAHITHA KURUNEGALA - UTHURUDIGA MAGEE PRAWAHANA SEWAYA	PB3874
SEEMASAHITHA KURUNEGALA KOLAMBA MAGEE PRAVAHANA SAMAGAMA	PB3907
SEEMASAHITHA KURUVIGOLLA GAMANEGUMA JANATHA SAMAGAMA	PB3745
SEEMASAHITHA KURUWENNA GAMIPUBUDU GAMANEGUMA JANATHA SAMAGAMA	PB4404
SEEMASAHITHA KURUWITA MALAWA GAMA GAMANEGUMA JANATHA SAMAGAMA	PB3656
SEEMASAHITHA LAK JANATHA CRUSHI WYAPARA	PV107148
SEEMASAHITHA LAKBO ENTERPRISES	PV79280
SEEMASAHITHA LANDUPITI GAMANEGUMA JANATHA SAMAGAMA	PB4526
SEEMASAHITHA LANKA JANADIRIYA ARTHIKA PUNARJEEWANA SAMAGAMA	PB4908
SEEMASAHITHA LASSAKANDA GAMANEGUMA JANATHA SAMAGAMA	PB3713
SEEMASAHITHA LASSEGAMA HAMBAWELA SWASHAKTHI GAMANEGUMA JANATHA SAMAGAMA	PB4383
SEEMASAHITHA LIHINIYAGALA GAMANEGUMA JANATHA SAMAGAMA	PB4375
SEEMASAHITHA LIYANAGODA GAMANEGUMA JANATHA SAMAGAMA	PB3972
SEEMASAHITHA LIYANGOLLA GAMANEGUMA JANATHA SAMAGAMA	PB3668
SEEMASAHITHA LUNUGALA GAMANEGUMA JANATHA SAMAGAMA	PB4670
SEEMASAHITHA MADABADDARAWATTA LUXMI GAMANEGUMA JANATHA SAMAGAMA	PB4131
SEEMASAHITHA MADAKUMBURA GAMANEGUMA JANATHA SAMAGAMA	PB4570
SEEMASAHITHA MADUGASTALAWA GAMANEGUMA JANATHA SAMAGAMA	PB3628
SEEMASAHITHA MADUWANWELA PARANIGAMAGAMANEGUMA JANATHA SAMAGAMA	PB4122
SEEMASAHITHA MAGAMA NAVODA GAMANEGUMA JANATHA SAMAGAMA	PB4641
SEEMASAHITHA MAGULDAMANA+E41502 GAMANEGUMA JANATHA SAMAGAMA	PB4217
SEEMASAHITHA MAHAALUTHGAMA ARA DAKUNA SRAMASHAKTHI GAMANEGUMA JANATHA SAMAGMA	PB4158
SEEMASAHITHA MAHABAGE SHAKTHI GAMANEGUMA JANATHA SAMAGAMA	PB4551
SEEMASAHITHA MAHADOWA ARUNODAYAGAMA GAMANEGUMA JANATHA SAMAGAMA	PB4550
SEEMASAHITHA MAHAGODAYAYA MAHASEN GAMANEGUAMA JANATHA SAMAGAMA	PB4438
SEEMASAHITHA MAHASENPURA JANASARANI GAMANEGUMA JANATHA SAMAGAMA	PB4698
SEEMASAHITHA MAHAWAGA NEGENAHIRA GAMANEGUMA JANATHA SAMAGAMA	PB3929
SEEMASAHITHA MAHAYAYA GAMANEGUMA JANATHA SAMAGAMA	PB4235
SEEMASAHITHA MAHINDAGAMA GAMANEGUMA JANATHA SAMAGAMA	PB3899
SEEMASAHITHA MAILAGASTENNA GAMANEGUMA JANATHA SAMAGAMA	PB4533
SEEMASAHITHA MAITHRI GAMA GAMANEGUMA JANATHA SAMAGAMA	PB4273
SEEMASAHITHA MAKALDENIYA GAMANEGUMA JANATHA SAMAGAMA	PB4011
SEEMASAHITHA MALAPOKUNA JANAHITHA GAMANEGUMA JANATHA SAMAGAMA	PB4265
SEEMASAHITHA MALDENIYA IHALA GAMANEGUMA JANATHA SAMAGAMA	PB3802
SEEMASAHITHA MALDENIYA PAHALA GAMANEGUMA JANATHA SAMAGAMA	PB3801
SEEMASAHITHA MALIBODA ORUPEELLA HALWATHURA ELLAPITA GAMANEGUMA JANATHA SAMAGAMA	PB4295
SEEMASAHITHA MALIYADDA GAMANEGUMA JANATHA SAMAGAMA	PB4521
SEEMASAHITHA MALLIGAWILA GAMANEGUMA JANATHA SAMAGAMA	PB4218
SEEMASAHITHA MALWATTA KIRIKOHUTENNA JAWAYA GAMANEGUMA JANATHA SAMAGAMA	PB4284
SEEMASAHITHA MALWATTA SAMANALA GAMANEGUAMA JANATHA SAMAGAMA	PB4455
SEEMASAHITHA MALWILA EKSATH GAMANEGUMA JANATHA SAMAGAMA	PB4405
SEEMASAHITHA MANIKKAWATTA IDUWARA GAMANEGUMA JANATHA SAMAGAMA	PB4128
SEEMASAHITHA MASPANANA GAMANEGUMA JANATHA SAMAGAMA	PB4026
SEEMASAHITHA MATHELIGAMA GAMANEGUMA JANATHA SAMAGAMA	PB3885
SEEMASAHITHA MAUSSAGOLLA BATAHIRA (IHALA) GAMANEGUMA JANATHA SAMAGAMA	PB4553
SEEMASAHITHA MAUSSAGOLLA BATAHIRA (PAHALA) ARUNA GAMANEGUMA JANATHA SAMAGAMA	PB4549
SEEMASAHITHA MAWELA BATAHIRA GAMANEGUMA JANATHA SAMAGAMA	PB4763
SEEMASAHITHA MEDAGAMA GAMANEGUMA JANATHA SAMAGAMA	PB4216
SEEMASAHITHA MEDAGAMPITIYA GAMANEGUMA JANATHA SAMAGAMA	PB4076
SEEMASAHITHA MEDAGODAGAMA GAMANEGUMA JANATHA SAMAGAMA	PB4040
SEEMASAHITHA MEDAKANDURA GAMANEGUAMA JANATHA SAMAGAMA	PB4512
SEEMASAHITHA MEDAWELAANA SHRAMASHAKTHI GAMANEGUMA JANATHA SAMAGAMA	PB4650
SEEMASAHITHA MEDAWELAANA YAGODA GAMANEGUMA JANATHA SAMAGAMA	PB4757
SEEMASAHITHA MEDAWELAGAMA GAMANEGUMA JANATHA SAMAGAMA	PB3625
SEEMASAHITHA MEDDEGAMA IHALA GAMANEGUMA JANATHA SAMAGAMA	PB4000
SEEMASAHITHA MEEDUMPITIYA ELLA GAMANEGUMA JANATHA SAMAGAMA	PB4630
SEEMASAHITHA MEEGAMUWA PRJA SANWARDANA SAMAGAMA	PB3303
SEEMASAHITHA MEEGASTENNA DEGALLASSA GAMANEGUMA JANATHA SAMAGAMA	PB4311
SEEMASAHITHA MEEGASTENNA PANAWATTA GAMANEGUMA JANATHA SAMAGAMA	PB4312
SEEMASAHITHA MEEMAMALAHENNA GAMANEGUMA JANATHA SAMAGAMA	PB4380
SEEMASAHITHA MEEWATHPURA GAMANEGUMA JANATHA SAMAGAMA	PB4221
SEEMASAHITHA MEMALAI GAMANEGUAMA JANATHA SAMAGAMA	PB4505
SEEMASAHITHA MIHINDUMPITIYA GOKULAME GAMANEGUMA JANATHA SAMAGAMA	PB4580
SEEMASAHITHA MIHINDUPURA MAHINDA GAMANEGUMA JANATHA SAMAGMA	PB4153
SEEMASAHITHA MILLAPITIYA SRI SUMANA GAMA NEGUMA JANATHA SAMAGAMA	PB3667
SEEMASAHITHA MILLAVIYA GAMANEGUMA JANATHA SAMAGAMA	PB4175
SEEMASAHITHA MILLAWITIYA SRI SUMANATISSA GAMANEGUMA JANATHA SAMAGAMA	PB3590
SEEMASAHITHA MINIPURA DUMBARA VINIVIDA GAMANEGUMA JANATHA SAMAGAMA	PB4142
SEEMASAHITHA MIRISBEDDA GAMA NEGUMA JANATHA SAMAGAMA	PB3574
SEEMASAHITHA MIYANAKOLATENNA GAMANEGUMA JANATHA SAMAGAMA	PB3843
SEEMASAHITHA MOLAMURA GAMANEGUMA JANATHA SAMAGAMA	PB3934
SEEMASAHITHA MOLKELE KENDALANDA GAMANEGUMA JANATHA SAMAGAMA	PB3641
SEEMASAHITHA MONARAWILA WEDAGEDARA	PV90563
SEEMASAHITHA MORABEDDA GAMANEGUAMA JANATHA SAMAGAMA	PB4492
SEEMASAHITHA MORAGAHALAGODA PUBUDU GAMANAGEMA JANATHA SAMAGAMA	PB4252
SEEMASAHITHA MORAYAYA DAKUNA GAMANEGUMA JANATHA SAMAGAMA	PB4364
SEEMASAHITHA MUDUNGAMA GAMANEGUMA JANATHA SAMAGAMA	PB4617
SEEMASAHITHA MUDUNKADAWALA PUBUDU GAMANEGUMA JANATHA SAMAGAMA	PB4213
SEEMASAHITHA MUGUNAGAHAPITIYA GAMANEGUAMA JANATHA SAMAGAMA	PB4493
SEEMASAHITHA MULADIYAWALA NEGENAHIRA GAMANEGUMA JANATHA SAMAGAMA	PB4536
SEEMASAHITHA MULUGAMA GAMANEGUAMJANATHA SAMAGAMA	PB3975
SEEMASAHITHA MUNASINGHEPURA GAMANEGUMA JANATHA SAMAGAMA	PB3698
SEEMASAHITHA MUTHUWELLA EKAMUTHU GAMANEGUMA JANATHA SAMAGAMA	PB4618
SEEMASAHITHA MUWANWEWA GAMANEGUMA JANATHA SAMAGAMA	PB3974
SEEMASAHITHA NADUKARADENIYA GAMANEGUMA JANATHA SAMAGAMA	PB3604
SEEMASAHITHA NAGARAPURA JANAHITHA GAMANEGUMA JANATHA SAMAGAMA	PB4336
SEEMASAHITHA NAHAWILA WATTA GAMANEGUMA JANATHA SAMAGAMA	PB4727
SEEMASAHITHA NAMAL MALIYADEWA GAMANEGUMA JANATHA SAMAGAMA	PB4237
SEEMASAHITHA NAVAGAHAELA GAMANEGUMA JANATHA SAMAGAMA	PB4212
SEEMASAHITHA NAWAJANAPADAYA GAMANEGUMA JANATHA SAMAGAMA	PB4201
SEEMASAHITHA NAWAMALDENIYA GAMANEGUMA JANATHA SAMAGAMA	PB4544
SEEMASAHITHA NAWAMILLANA GAMANEGUMA JANATHA SAMAGAMA	PB4099
SEEMASAHITHA NAWANAGARAYAGAMA GAMANEGUMA JANATHA SAMAGAMA	PB4038
SEEMASAHITHA NAWELA NEGENAHIRA GAMANEGUMA JANATHA SAMAGAMA	PB4609
SEEMASAHITHA NEDOLA GAMANGEGUMA JANATHA SAMAGAMA	PB3901
SEEMASAHITHA NEGENAHIRA MAHAWEWA GAMANEGUMA JANATHA SAMAGAMA	PB4101
SEEMASAHITHA NELUYAYA GAMANEGUMA JANATHA SAMAGAMA	PB3996
SEEMASAHITHA NETALAPORUWA GAMA NEGUMA JANATHA SAMAGAMA	PB3617
SEEMASAHITHA NEW MADAKUMBURA GAMANEGUMA JANATHA SAMAGAMA	PB4548
SEEMASAHITHA NILDANDAHEENA GAMANEGUAMA JANATHA SAMAGAMA	PB4508
SEEMASAHITHA NILWALA GAMANEGUMA JANATHA SAMAGAMA	PB4591
SEEMASAHITHA NILWALA PALLEBAGE GAMANEGUMA JANATHA SAMAGAMA	PB4537
SEEMASAHITHA NIYADELLA RANIWEWA GAMANEGUMA JANATHA SAMAGAMA	PB4215
SEEMASAHITHA NIYAMGAMDORA GAMANEGUMA JANATHA SAMAGAMA	PB4557
SEEMASAHITHA NUGAGAHAKUWULA SAMPATH GAMANEGUMA JANATHA SAMAGAMA	PB3725
SEEMASAHITHA NUGAWELA GAMANEGUMA JANATHA SAMAGAMA	PB4416
SEEMASAHITHA NUGEKANDA SETHSIRI GAMANEGUMA JANATHA SAMAGAMA	PB4298
SEEMASAHITHA OKANDAYAYA BATAHIRA GAMANEGUMA JANATHA SAMAGAMA	PB4344
SEEMASAHITHA OMALPE NILWALA GAMANEGUMA JANATHA SAMAGAMA	PB4117
SEEMASAHITHA OMANTHA GAMANEGUMA JANATHA SAMAGAMA	PB3764
SEEMASAHITHA OMARA NEGENAHIRA GAMANEGUMA JANATHA SAMAGAMA	PB4293
SEEMASAHITHA ONETICA	PV61683
SEEMASAHITHA OODAPOLA GAMANEGUMA JANATHA SAMAGAMA	PB4611
SEEMASAHITHA OODAPOLA KUMBURUGAMA GAMANEGUAMA JANATHA SAMAGAMA	PB4468
SEEMASAHITHA OVILANA GAMANEGUMA JANATHA SAMAGAMA	PB4069
SEEMASAHITHA OVITIGAMA GAMANEGUMA JANATHA SAMAGAMA	PB3715
SEEMASAHITHA OWALA SAMGI GRAMEEYA JALAWIDULI PARIBHOGIKA SAMAGAMA	PB4791
SEEMASAHITHA PABEGAMA GAMANEGUMA JANATHA SAMAGAMA	PB4278
SEEMASAHITHA PADAVIGAMA GAMANEGUMA JANATHA SAMAGMA	PB4169
SEEMASAHITHA PADAWGAMA PRAGATHI GAMANEGUMA JANATHA SAMAGAMA	PB3967
SEEMASAHITHA PAHALA DAIGALA GAMANEGUMA JANATHA SAMAGAMA	PB4400
SEEMASAHITHA PAHALA DANDENIYA GAMANEGUMA JANATHA SAMAGAMA	PB4003
SEEMASAHITHA PAHALA YAKKURE GAMANEGUMA JANATHA SAMAGAMA	PB4095
SEEMASAHITHA PAHALA YAKTHURE RANTEBE GAMANEGUMA JANATHA SAMAGAMA	PB4085
SEEMASAHITHA PAHALAGAMA GAMANEGUMA JANATHA SAMAGAMA	PB4538
SEEMASAHITHA PALATIYAWA NEGENAHIRA GAMANEGUMA JANATHA SAMAGAMA	PB4075
SEEMASAHITHA PALLATHTHARA DAKUNA GAMANEGUMA JANATHA SAMAGAMA	PB4068
SEEMASAHITHA PALLAWA NIDAHASGAMA GAMANEGUMA JANATHA SAMAGAMA	PB3983
SEEMASAHITHA PALUGAMA GAMANEGUAMA JANATHA SAMAGAMA	PB4511
SEEMASAHITHA PANAPOLA PRABHASHWARA GAMANEGUMA JANATHA SAMAGAMA	PB4125
SEEMASAHITHA PANAWATTA PALALLEGAMA GAMANEGUAMA JANATHA SAMAGAMA	PB4434
SEEMASAHITHA PANDAHA HIGURANA GAMANEGUMA JANATHA SAMAGAMA	PB4299
SEEMASAHITHA PANDAHA THALAWA GAMANEGUAMA JANATHA SAMAGAMA	PB4467
SEEMASAHITHA PANNAGAMUWA DIYABEDIYA DAHATHAGAMA GAMANEGUMA JANATHA SAMAGAMA	PB4644
SEEMASAHITHA PANNILA BATAHIRA GAMANEGUMA JANATHA SAMAGAMA	PB4622
SEEMASAHITHA PANNILA NEGENAHIRA GAMANEGUMA JANATHA SAMAGAMA	PB4248
SEEMASAHITHA PARAGAHAMADITTA GAMANEGUMA JANATHA SAMAGAMA	PB3995
SEEMASAHITHA PARAGODA NEGENAHIRA GAMANEGUMA JANATHA SAMAGAMA	PB3763
SEEMASAHITHA PARAKRAMAPURA GAMANEGUMA JANATHA SAMAGAMA	PB3951
SEEMASAHITHA PARAKUMPURA GAMANEGUMA JANATHA SAMAGAMA	PB3728
SEEMASAHITHA PARAWAHNAKADA GAMANEGUMA JANATHA SAMAGAMA	PB3627
SEEMASAHITHA PARAWALATENNA KELANINADEE GAMANEGUAMA JANATHA SAMAGAMA	PB4444
SEEMASAHITHA PARKADUWA GAMANEGUMA JANATHA SAMAGAMA	PB3719
SEEMASAHITHA PASSARA KOTASA GAMANEGUMA JANATHA SAMAGAMA	PB4583
SEEMASAHITHA PASSARA PALLEGAMA GAMANEGUMA JANATHA SAMAGAMA	PB3700
SEEMASAHITHA PATHBERIYA GAMANEGUMA JANATHA SAMAGAMA	PB3646
SEEMASAHITHA PATHBERIYA SAUBHAGYA GAMANEGUMA JANATHA SAMAGAMA	PB3647
SEEMASAHITHA PATHBERIYA WIKASITA GAMANEGUMA JANATHA SAMAGAMA	PB3706
SEEMASAHITHA PELELLAGAMA SUHADA PRAJA GAMANEGUMA JANATHA SAMAGAMA	PB4306
SEEMASAHITHA PELGAHATENNA GAMANEGUMA JANATHA SAMAGAMA	PB3744
SEEMASAHITHA PIHITIWEWA GAMANEGUMA JANATHA SAMAGAMA	PB4070
SEEMASAHITHA PINARAWA WATTA GAMANEGUMA JANATHA SAMAGAMA	PB4725
SEEMASAHITHA PINNAKANDA GAMANEGUMA JANATHA SAMAGAMA	PB3927
SEEMASAHITHA PITAMARUWA GAMANEGUMA JANATHA SAMAGAMA	PB4610
SEEMASAHITHA PIVISIGAMA SHRAMASHAKTHI GAMANEGUMA JANATHA SAMAGAMA	PB4290
SEEMASAHITHA PODDENIKANDA BADUWATTA SUWANODAYA GAMANEGUMA JANATHA SAMAGAMA	PB4368
SEEMASAHITHA PODDENIKANDA GAMANEGUMA JANATHA SAMAGAMA	PB4378
SEEMASAHITHA POHORAMBAWA SUPIPI GAMANEGUAMA JANATHA SAMAGAMA	PB3662
SEEMASAHITHA POLGAGAWELENA GAMANEGUMA JANATHA SAMAGAMA	PB4592
SEEMASAHITHA POLGASWATTA GAMANEGUAMA JANATHA SAMAGAMA	PB4470
SEEMASAHITHA POLPETIYA DEDIGAMANA GAMANEGUMA JANATHA SAMAGAMA	PB4313
SEEMASAHITHA POLPITHIGAMA SAVIYA GRAMEEYA KRUSHIKARMA (JANATHA) GOVI SAMAGAMA	PB3751
SEEMASAHITHA POLWATHUGODA EKAMUTHU GAMANDGUMA JANATHA SAMAGAMA	PB3987
SEEMASAHITHA POOGIGODA GAMANEGUMA JANATHA SAMAGAMA	PB4558
SEEMASAHITHA PRAJA DARA WIDULI SAMAGAMA	PB5108
SEEMASAHITHA PRAKRAMA TRADING	PV17854
SEEMASAHITHA PROTOP GAMANEGUMA JANATHA SAMAGAMA222343	PB4860
SEEMASAHITHA PUBUDUWEWAGAMA GAMANEGUMA JANATHA SAMAGAMA	PB4554
SEEMASAHITHA PUDALUMULLA GAMANEGUMA JANATHA SAMAGAMA	PB4673
SEEMASAHITHA PUHULWATTA GAMANEGUMA JANATHA SAMAGAMA	PB3650
SEEMASAHITHA PUKUNUWALA GAMANEGUAMA JANATHA SAMAGAMA	PB4454
SEEMASAHITHA PULATHISI PRAJA SANWARDANA SAMAGAMA (NPBS 1293)	PB1821
SEEMASAHITHA PUNCHIAPPU JADURA GAMANEGUMA JANATHA SAMAGAMA	PB4589
SEEMASAHITHA PUNCHIWEVA GAMANEGUMA JANATHA SAMAGA,A	PB3982
SEEMASAHITHA PUNCITY CREATIONS	PV62262
SEEMASAHITHA PURANKUMBURA GAMANEGUAMA JANATHA SAMAGAMA	PB4507
SEEMASAHITHA PUSSATHOTA GAMANEGUMA JANATHA SAMAGAMA	PB3919
SEEMASAHITHA RAINDAPOLA GAMANEGUMA JANATHA SAMAGAMA	PB3701
SEEMASAHITHA RAMBUKE GAMANEGUMA JANATHA SAMAGAMA	PB4545
SEEMASAHITHA RAMBUKWEWA SITHUMINA GAMANEGUMA JANATHA SAMAGMA	PB4148
SEEMASAHITHA RAMBUKYAYA GAMANEGUMA JANATHA SAMAGAMA	PB4726
SEEMASAHITHA RANASINGHAGODA GAMANEGUMA JANATHA SAMAGAMA	PB4254
SEEMASAHITHA RANASIRIPURA EKAMUTHU GAMANEGUMA JANATHA SAMAGMA	PB4163
SEEMASAHITHA RANASIRIPURA SAMAGI GAMANEGUMA JANATHA SAMAGMA	PB4159
SEEMASAHITHA RANDUNUWATTA EKAMUTHU GAMANEGUMA JANATHA SAMAGAMA	PB4636
SEEMASAHITHA RANDUNUWATTA WEWUSIRIGAMA GAMANEGUMA JANATHA SAMAGAMA	PB4680
SEEMASAHITHA RANKIDA UTHURA GAMANEGUMA JANATHA SAMAGAMA	PB4059
SEEMASAHITHA RANMAL SWASHAKTHI GAMANEGUMA JANATHA SAMAGAMA	PB4339
SEEMASAHITHA RATHABA GAMANEGUMA JANATHA SAMAGAMA	PB3884
SEEMASAHITHA RATHMALKANDIYA GAMANEGUMA JANATHA SAMAGAMA	PB4210
SEEMASAHITHA RATHMALTENNA GAMANEGUMA JANATHA SAMAGAMA	PB4220
SEEMASAHITHA RATHNAGIRIYA GAMANEGUMA JANATHA SAMAGAMA	PB4574
SEEMASAHITHA RATHNAPURA MAGEE PRAVAHANA SEVAYA	PB3803
SEEMASAHITHA RIDIGAMA IRIYAGOLLA GAMANEGUMA JANATHA SAMAGAMA	PB4730
SEEMASAHITHA RITIKUMBURA+E41002 GAMANEGUMA JANATHA SAMAGAMA	PB4039
SEEMASAHITHA ROHANAPURA+E43612 GAMANEGUAMA JANATHA SAMAGAMA	PB4446
SEEMASAHITHA ROJASANGAMA DAKUNA GAMANEGUMA JANATHA SAMAGAMA	PB4539
SEEMASAHITHA RUHUNU DANAWWA GAMANEGUMA JANATHA SAMAGAMA	PB3737
SEEMASAHITHA RUHUNU GIRUWAPATTU GAMIDIRIYA SAMAGAMA	PB1765
SEEMASAHITHA RUHUNU SANWARDHANA MITURU PADANAMA	PV83745
SEEMASAHITHA RUHUNUKETHA GAMANEGUMA JANATHA SAMAGAMA	PB4219
SEEMASAHITHA SAAGALA UTHURA GAMANEGUAMA JANATHA SAMAGAMA	PB4432
SEEMASAHITHA SADUNGAMA GAMANEGUMA JANATHA SAMAGAMA	PB4264
SEEMASAHITHA SALIYAPURA HARITHA GAMANEGUMA JANATHA SAMAGAMA	PB3962
SEEMASAHITHA SALIYA[PURA UTHURA GAMANEGUMA JANATHA SAMAGAMA	PB4639
SEEMASAHITHA SAMAGI AMBATENNA GAMANEGUMA JANATHA SAMAGAMA	PB3695
SEEMASAHITHA SANDAGALATENNA EKAMUTHU GAMANEGUMA JANATHA SAMAGAMA	PB4043
SEEMASAHITHA SANDUNGAMA GAMANEGUMA JANATHA SAMAGAMA	PB4586
SEEMASAHITHA SAPUMAL JANAPADAYA GAMANEGUMA JANATHA SAMAGAMA	PB4108
SEEMASAHITHA SARUBIMA NEGENAHIRA GAMANEGUMA JANATHA SAMAGAMA	PB4179
SEEMASAHITHA SARUBIMA UTHURA GAMANEGUMA JANATHA SAMAGAMA	PB4181
SEEMASAHITHA SAUDIRIGAMA GAMANEGUMA JANATHA SAMAGAMA	PB4355
SEEMASAHITHA SAUTH KETABULAWA GAMANEGUMA JANATHA SAMAGAMA	PB4546
SEEMASAHITHA SEEPON NAGASTENNA GAMANEGUMA JANATHA SAMAGAMA	PB4427
SEEMASAHITHA SEEPON SAMAGI GAMANEGUMA JANATHA SAMAGAMA	PB4314
SEEMASAHITHA SEEPON SWASHAKTHI GAMANEGUMA JANATHA SAMAGAMA	PB4410
SEEMASAHITHA SEETHAGALGODA GAMANEGUMA JANATHA SAMAGAMA	PB3970
SEEMASAHITHA SERUPITIYA GAMANEGUMA JANATHA SAMAGAMA	PB4530
SEEMASAHITHA SHAKTHI GADOL SAMAGAMA	PB3507
SEEMASAHITHA SHARAC SAFETY INTERNATIONAL	PV84886
SEEMASAHITHA SIKURA AYOJANA	PV119867
SEEMASAHITHA SILATENNA IHALA GAMANEGUMA JANATHA SAMAGAMA	PB4119
SEEMASAHITHA SILATENNA PAHALA GAMANEGUMA JANATHA SAMAGAMA	PB4120
SEEMASAHITHA SINGHAPURA GAMANEGUMA JANATHA SAMAGAMA	PB4266
SEEMASAHITHA SINIMUNNA PRABODHA GAMANEGUMA JANATHA SAMAGAMA	PB4203
SEEMASAHITHA SIRADUNNA GAMANEGUMA JANATHA SAMAGAMA	PB3948
SEEMASAHITHA SIRISAMANGAMA GAMANEGUAMA JANATHA SAMAGAMA	PB4441
SEEMASAHITHA SITINAMALUWA DAKUNA GAMANEGUMA JANATHA SAMAGAMA	PB4057
