name	registration_no
SEEMASAHITHA SIYAMBALAKELE GAMANEGUMA JANATHA SAMAGAMA	PB4092
SEEMASAHITHA SOORIYAGAMA GAMANEGUMA JANATHA SAMAGAMA	PB4524
SEEMASAHITHA SUDAGALA SAMAGI GAMANEGUMA SAMAGAMA	PB3740
SEEMASAHITHA SUDUGALA GAMANEGUMA JANATHA SAMAGAMA	PB4232
SEEMASAHITHA SUMUDUGAMA GAMANEGUMA JANATHA SAMAGAMA	PB3655
SEEMASAHITHA SUN STAR MOON (PAUDGALIKA) SAMAGAMA	PV86170
SEEMASAHITHA SUSEDI AYOJANA	PV79692
SEEMASAHITHA SWARNA PRADEEPA GAMANEGUMA JANATHA SAMAGAMA	PB4335
SEEMASAHITHA SWAYANG SHAKTHI SANWARDHANA PADANAMA (PAUDGALIKA) SAMAGAMA	PV77628
SEEMASAHITHA T-THERIPAHA GAMANEGUMA JANATHA SAMAGAMA	PB4532
SEEMASAHITHA TALAGALA KUMBUKAWATTA GAMANEGUMA JANATHA SAMAGAMA	PB3762
SEEMASAHITHA TALAPITIYA GAMANEGUAMA JANATHA SAMAGAMA	PB4442
SEEMASAHITHA TAMWATTA GAMANEGUMA JANATHA SAMAGAMA	PB4710
SEEMASAHITHA TELLA SWASHAKTHI GAMANEGUMA JANATHA SAMAGAMA	PB4138
SEEMASAHITHA TEPPANAWA PUBUDU SAVIYA GAMANEGUMA JANATHA SAMAGAMA	PB3707
SEEMASAHITHA THA) KURUNDUWATTA GAMIDIRIYA SAMAGAMA	PB1002
SEEMASAHITHA THALAKUMBURA GAMANEGUMA JANATHA SAMAGAMA	PB4286
SEEMASAHITHA THALDENA BATAHIRA GAMANEGUMA JANATHA SAMAGAMA	PB4576
SEEMASAHITHA THALDENA NEGENAHIRA GAMANEGUMA JANATHA SAMAGAMA	PB4577
SEEMASAHITHA THALTHOTA GAMANDGUMA JANATHA SAMAGAMA	PB3942
SEEMASAHITHA THALWATTA BATAHIRA GAMANEGUMA JANATHA SAMAGAMA	PB4269
SEEMASAHITHA THAMBAGAMUWA BATAHIRA GAMANEGUMA JANATHA SAMAGAMA	PB3990
SEEMASAHITHA THANJANTHENNA GAMANDGUMA JANATHA SAMAGAMA	PB3903
SEEMASAHITHA THELDENIYA PAHALA GAMANEGUMA JANATHA SAMAGAMA	PB4118
SEEMASAHITHA THELDENIYA WISHWA GAMANEGUMA JANATHA SAMAGMA	PB4155
SEEMASAHITHA THELHAWADIGAMA GAMANEGUMA JANATHA SAMAGAMA	PB4042
SEEMASAHITHA THENNAKONWELA GAMANEGUMA JANATHA SAMAGAMA	PB4104
SEEMASAHITHA THIMBIRIYA SAMAGI GAMANEGUMA JANATHA SAMAGAMA	PB4392
SEEMASAHITHA THISPAHE KANDA GAMANEGUMA JANATHA SAMAGAMA	PB4414
SEEMASAHITHA THOMPITIYA 2 GAMANEGUMA JANATHA SAMAGAMA	PB4030
SEEMASAHITHA THORAARAGAMA GAMANEGUMA JANATHA SAMAGAMA	PB4563
SEEMASAHITHA THORAKOLAYAYA GAMANEGUMA JANATHA SAMAGAMA	PB4262
SEEMASAHITHA THUNHITIYAWA GAMANEGUMA JANATHA SAMAGAMA	PB4528
SEEMASAHITHA TISSAMAHARAMA VIHARAMAHADEVI GAMANEGUMA JANATHA SAMAGAMA	PB4649
SEEMASAHITHA TISSAPURA BOKUTUPELESSA GAMANEGUMA JANATHA SAMAGAMA	PB4640
SEEMASAHITHA TISSAPURA GAMANEGUMA JANATHA SAMAGAMA	PB3734
SEEMASAHITHA TISSAPURA PUBUDU GAMANEGUMA JANATHA SAMAGAMA	PB4682
SEEMASAHITHA TISSAPURA UDANA GAMANEGUMA JANATHA SAMAGAMA	PB4642
SEEMASAHITHA TRIKUNAMALAYA PRAJA SANWARDHANA HA SANRAKSHITHA SAMAGAMA	PB3824
SEEMASAHITHA UDABADANA GAMANEGUMA JANATHA SAMAGAMA	PB4079
SEEMASAHITHA UDABAGEGAMA GAMANEGUMA JANATHA SAMAGAMA	PB4590
SEEMASAHITHA UDAKADA GAMA NEGUMA JANATHA SAMAGAMA	PB3589
SEEMASAHITHA UDAMADURA UTHURA GAMANEGUMA JANATHA SAMAGAMA	PB4656
SEEMASAHITHA UDAWELA GAMANEGUMA JANATHA SAMAGAMA	PB4391
SEEMASAHITHA UDAYALAGAMA GAMANEGUMA JANATHA SAMAGAMA	PB3675
SEEMASAHITHA UDUPILA AKKARA ASUWA GAMANEGUMA JANATHA SAMAGAMA	PB4651
SEEMASAHITHA ULAHITIYAWA NEGENAHIRA GAMANEGUMA JANATHA SAMAGAMA	PB4309
SEEMASAHITHA ULHITIYA MALGODA GAMANEGUMA JANATHA SAMAGAMA	PB4289
SEEMASAHITHA ULHITIYA NEGENAHIRA GAMANEGUMA JANATHA SAMAGAMA	PB4294
SEEMASAHITHA ULKANDA DIRIYA SHAKTHI GAMANEGUMA JANATHA SAMAGAMA	PB4560
SEEMASAHITHA UTHURA EKNELIGODA PRABUDDHA GAMANEGUMA JANATHA SAMAGAMA	PB3720
SEEMASAHITHA UTHURU EKNELIGODA EKAMUTHU GAMANEGUMA JANATHA SAMAGAMA	PB3644
SEEMASAHITHA VIHARAGALA GAMANUGUMA JANATHA	PB4744
SEEMASAHITHA VISAMTHURA GAMANEGUMA JANATHA SAMAGAMA	PB4229
SEEMASAHITHA WAKAMULLA GAMA NEGUMA JANATHA SAMAGAMA	PB3613
SEEMASAHITHA WALAKADA GAMANEGUMA JANATHA SAMAGAMA	PB4006
SEEMASAHITHA WALANDURA GAMANEGUMA JANATHA SAMAGAMA	PB3643
SEEMASAHITHA WALAPALAWA GAMANEGUMA JANATHA SAMAGAMA	PB4263
SEEMASAHITHA WALIPATHAYAYA IHALA GAMANDGUMA JANATHA SAMAGAMA	PB3922
SEEMASAHITHA WALIPATHAYAYA PAHALAGAMANDGUMA JANATHA SAMAGAMA	PB3921
SEEMASAHITHA WALPOLA DELMALUWA GAMANEGUMA JANATHA SAMAGAMA	PB4384
SEEMASAHITHA WALPOLA MEEGASTENNA GAMANEGUMA JANATHA SAMAGAMA	PB4261
SEEMASAHITHA WALPOLA SAPUMALKANDA GAMANEGUMA JANATHA SAMAGAMA	PB4623
SEEMASAHITHA WALPOLA SHRAMASHAKTHI GAMANEGUMA JANATHA SAMAGAMA	PB4245
SEEMASAHITHA WARAKETIARA GAMANEGUMA JANATHA SAMAGAMA	PB4347
SEEMASAHITHA WASANAGAMA GAMANEGUMA JANATHA SAMAGAMA	PB4564
SEEMASAHITHA WATTEGAMA GAMANEGUMA JANATHA SAMAGAMA	PB3733
SEEMASAHITHA WATTEGEDARA PRAJASHAKTHI GAMANEGUAMA JANATHA SAMAGAMA	PB4479
SEEMASAHITHA WAWKELE PAHALA GAMANEGUMA JANATHA SAMAGAMA	PB4581
SEEMASAHITHA WAWWA GAMANEGUMA JANATHA SAMAGAMA	PB4356
SEEMASAHITHA WEBEDDA ELLE ARAVA GAMANEGUMA JANATHA SAMAGAMA	PB4381
SEEMASAHITHA WEDAMULLA GAMANEGUAMA JANATHA SAMAGAMA	PB4506
SEEMASAHITHA WEDEHAPURA MINIMUTHU GAMANEGUMA JANATHA SAMAGAMA	PB4699
SEEMASAHITHA WEERAGASWEWA GAMANEGUMA JANATHA SAMAGAMA	PB3659
SEEMASAHITHA WEERALANDA GAMANEGUMA JANATHA SAMAGAMA	PB3900
SEEMASAHITHA WEERAPITIYA GAMANEGUMA JANATHA SAMAGAMA	PB3660
SEEMASAHITHA WEERAPOLA KUDAGAMMANA HATHA GAMANEGUMA JANATHA SAMAGAMA	PB4645
SEEMASAHITHA WEERAPOLA SUBODHAPURA GAMANEGUMA JANATHA SAMAGAMA	PB4646
SEEMASAHITHA WEHERAGALA AGUNUKOLAWEWA THIRASARA GAMANEGUMA JANATHA SAMAGAMA	PB3964
SEEMASAHITHA WEHERAGODA GAMANEGUMA JANATHA SAMAGAMA	PB4672
SEEMASAHITHA WELAGANWALA GAMA NEGUMA JANATHA SAMAGAMA	PB3601
SEEMASAHITHA WELANGASPITIYA GAMANEGUMA JANATHA SAMAGAMA	GA2622
SEEMASAHITHA WELANGASPITIYA SAMADHI GAMANEGUMA JANATHA SAMAGAMA	PB4841
SEEMASAHITHA WELIARA GAMANEGUMA JANATHA SAMAGAMA	PB4239
SEEMASAHITHA WELIBODA SAMANALAGAMA GAMANEGUAMA JANATHA SAMAGAMA	PB4463
SEEMASAHITHA WELIHELATENNA DAKUNA GAMANEGUMA JANATHA SAMAGAMA	PB4256
SEEMASAHITHA WELIHINDA HUNUGALDENIYA GAMANEGUMA JANATHA SAMAGAMA	PB3679
SEEMASAHITHA WELIKADAYAYA GAMANEGUMA JANATHA SAMAGAMA	PB4249
SEEMASAHITHA WELIWEHARA GAMANEGUMA JANATHA SAMAGAMA	PB4812
SEEMASAHITHA WELLASSA GAMIDIRIYA EKABADDA SAMAGAMA	PB1311
SEEMASAHITHA WELLEWA GAMANEGUMA JANATHA SAMAGMA	PB4171
SEEMASAHITHA WELLIGATTA GAMANEGUMA JANATHA SAMAGMA	PB4152
SEEMASAHITHA WENIVELARA ASIRI GAMANEGUMA JANATHA SAMAGAMA	PB4310
SEEMASAHITHA WERAGAMA GAMANEGUMA JANATHA SAMAGAMA	PB4373
SEEMASAHITHA WERAGODA GAMANEGUMA JANATHA SAMAGAMA	PB3756
SEEMASAHITHA WERELLAPATANA GAMANEGUMA JANATHA SAMAGAMA	PB3721
SEEMASAHITHA WERELLAPITIYA FACTORY CITIZON GAMANEGUMA JANATHA SAMAGAMA	PB4600
SEEMASAHITHA WEWABEDDA GAMANEGUMA JANATHA SAMAGAMA	PB4632
SEEMASAHITHA WEWANDON GAMANEGUAMA JANATHA SAMAGAMA	PB4502
SEEMASAHITHA WIHARAGALA PANSIYAYA PANAHA YAYA GAMANEGUMA JANATHA SAMAGAMA	PB4421
SEEMASAHITHA WIJANATHKUMBURA GAMANEGUAMJANATHA SAMAGAMA	PB3973
SEEMASAHITHA WIJAYAPURA JANAJAYA GAMANEGUMA JANATHA SAMAGAMA	PB4679
SEEMASAHITHA WILGAMDEMATAWEWA GAMANEGUMA JANATHA SAMAGAMA	PB3984
SEEMASAHITHA WITHARAMPANGUWA GAMA NEGUMA JANATHA SAMAGAMA	PB3616
SEEMASAHITHA YAHALMULLA SHAKTHI GAMANEGUMA JANATHA SAMAGAMA	PB4253
SEEMASAHITHA YAKAWA GAMANEGUMA JANATHA SAMAGAMA	PB4024
SEEMASAHITHA YAKKURE GAMANEGUMA JANATHA SAMAGAMA	PB4088
SEEMASAHITHA YAPAHUWA GAMANEGUMA JANATHA SAMAGAMA	PB3560
SEEMASAHITHA YASASA SANWARDHANA SAMAGAMA	PB5154
SEEMASAHITHA YATIELLA GAMANEGUMA JANATHA SAMAGAMA	PB4701
SEEMASAHITHA YODAKANDIYA GAMANEGUMA JANATHA SAMAGAMA	PB4678
SEEMASAHITHA YOMBUWELTENNA GAMANEGUAMA JANATHA SAMAGAMA	PB4489
SEEMASAHITHA(JANATHA) BALAGALA GEMIDIRIYA SAMAGAMA	PB515
SEEMASAHITHA(JANATHA) BALATHOTA ELLA GAMIDIRIYA SAMAGAMA	PB3433
SEEMASAHITHA(JANATHA) DEHERAGODA KENDALANDA GEMIDIRIYA SAMAGAM	PB1341
SEEMASAHITHA(JANATHA) EKABADDHA GOVI SAMAGAMA	PB757
SEEMASAHITHA(JANATHA) ETTHALAMULLA GEMIDIRIYA SAMAGAMA	PB789
SEEMASAHITHA(JANATHA) HAKURUWELA GAMIDIRIYA SAMAGAMA	PB3061
SEEMASAHITHA(JANATHA) HALLINNA IHALA GAMIDIRIYA SAMAGAMA	PB3421
SEEMASAHITHA(JANATHA) HATANGALA GAMIDIRIYA SAMAGAMA	PB3279
SEEMASAHITHA(JANATHA) HIRIYALA GOVIJANA SAMAGAMA	PB444
SEEMASAHITHA(JANATHA) KADURUPOKUNA UTURA GEMIDIRIYA SAMAGAMA	PB3118
SEEMASAHITHA(JANATHA) KAHATARUPPA GAMIDIRIYA SAMAGAMA	PB3422
SEEMASAHITHA(JANATHA) KAPURUWATTA GAMIDIRIYA SAMAGAMA	PB3426
SEEMASAHITHA(JANATHA) KATTAKADUWA DAKUNA ARUNALU GEMIDIRIYA SAMAGAMA	PB3088
SEEMASAHITHA(JANATHA) KATUTALAARAGAMA GEMIDIRIYA SAMAGAMA	PB770
SEEMASAHITHA(JANATHA) KOKAGALA GEMIDIRIYA SAMAGAMA	PB3263
SEEMASAHITHA(JANATHA) KOTAKITHULA DAKUNA GAMIDIRIYA SAMAGAMA	PB3418
SEEMASAHITHA(JANATHA) KOTTALBEDDA GEMIDIRIYA SAMAGAMA	PB3104
SEEMASAHITHA(JANATHA) MADUWATTA GEMIDIRIYA SAMAGAMA	PB3124
SEEMASAHITHA(JANATHA) MELLAGAMA GEMIDIRIYA SAMAGAMA	PB3067
SEEMASAHITHA(JANATHA) PAHALAWATTA GAMIDIRIYA SAMAGAMA	PB3424
SEEMASAHITHA(JANATHA) PAHALAYALKUMBURA GAMIDIRIYA SAMAGAMA	PB3413
SEEMASAHITHA(JANATHA) PALLEKIRUWA GEMIDIRIYA SAMAGAMA	PB3179
SEEMASAHITHA(JANATHA) PARK GEMIDIRIYA SAMAGAMA	PB3202
SEEMASAHITHA(JANATHA) PATHAKADA GAMIDIRIYA SAMAGAMA	PB3123
SEEMASAHITHA(JANATHA) PELGASTENNA GAMIDIRIYA SAMAGAMA	PB3414
SEEMASAHITHA(JANATHA) PESSAGAMA GEMIDIRIYA SAMAGAMA	PB3192
SEEMASAHITHA(JANATHA) REDEEWITA GEMIDIRIYA SAMAGAMA	PB3269
SEEMASAHITHA(JANATHA) TALAGAHAGEDARA GAMIDIRIYA SAMAGAMA	PB3425
SEEMASAHITHA(JANATHA) TETILLA GEMIDIRIYA SAMAGAMA	PB3043
SEEMASAHITHA(JANATHA) UDAKIRUWA GEMIDIRIYA SAMAGAMA	PB3196
SEEMASAHITHA(JANATHA) URUMEETENNA GAMIDIRIYA SAMAGAMA	PB3423
SEEMASAHITHA(JANATHA) WATHUPITIYA WANDAGALA GAMIDIRIYA SAMAGAMA	PB3128
SEEMASAHITHA(JANATHA) WELIGAMPURA GAMIDIRIYA SAMAGAMA	PB3442
SEEMASAHITHA(JANATHA) WERAGAMA GEMIDIRIYA SAMAGAMA	PB3122
SEEMASAHITHA(JANATHA)NEGENEHIRA GANGULVITIYA GEMIDIRIYA SAMAGMA	PB3194
SEEMASAHITHTHA SHANTHEEN SAMAGAMA	PB4810
SEEMASAHITTHA ENVIRONMENTAL AND COMMUNITY DEVELOPMENT INFORMATION CENTRE SAMAGAMA	PB4748
SEEMASAHTHA REKAULA GAMANEGUMA JANATHA SAMAGAMA	PB3886
SEEMASAHTHA WAWEKELE IHALA GAMANEGUMA JANATHA SAMAGAMA	PB4628
SEEMASATHITHA DIGGALPURA YAYA PAHA SAMAGI GAMANEGUMA JANATHA SAMAGAMA	PB4848
SEEMASATHITHA MATARA DISTRIK PAUDGALIKA BUS SAMAGAMA	PB4519
SEEMASHITHA GALENBINDUNUWEWA NISHPADANA ALEVI SANWARDENA SEWA SAMAGANA	PB3483
SEEMASS TRADING	PV00212040
SEEMATI	PV78292
SEEMATI CURRANCY EXCHANGE	PV89012
SEEMAX GLOBAL TRADING	PV00232095
SEEMAX TRAVELS AND TOURS	PV91263
SEEMENT ENTERPRISES	PV00230577
SEEMSAHITA (JANATHA) ALUYATAWELA GAMIDIRIYA SAMAGAMA (NEPV 747)	PB1656
SEEMSAHITA (JANATHA) MUTHUKELIYAWA GAMIDIRIYA SAMAGAMA (NEPV 624)	PB1655
SEEMSAHITA (JANATHA) OKKAMPITIYA GAMIDIRIYA SAMAGAMA (NEPV 531)	PB1654
SEEMSAHITA (JANATHA) THERAPAHUWA DEVANA PIYAWARA GAMIDIRIYA SAMAGAMA (NEPV 751)	PB1657
SEEMSAHITA (JANATHA) THERAPAHUWA PALAMU PIYAWARA GAMIDIRIYA SAMAGAMA (NEPV 752)	PB1658
SEEMSAHITHA	PV21918
SEEMSAHITHA SAMADHI GAMANEGUMA JANATHA SAMAGAMA	PB4809
SEEMSASAHITHA (JANATHA) DENAGAMA BATAHIRA NAVODA GAMIDIRIYA SAMAGAMA (NEPV 293)	PB1604
SEEMSASAHITHA (JANATHA) KARAGAHAPOLA GAMIDIRIYA SAMAGAMA (NEPV 485)	PB1596
SEEMSASAHITHA (JANATHA) MANTENNA GAMIDIRIYA SAMAGAMA	PB714
SEEMSASAHITHA (JANATHA) NERALAMPITIYA GAMIDIRIYA SAMAGAMA (NEPV 259)	PB1590
SEEMSASAHITHA (JANATHA) OORUMUTTA DAKUNA VIDURA GAMIDIRIYA SAMAGAMA (NEPV 513)	PB1592
SEEMSASAHITHA (JANATHA) PANANA HANDUNKANDA GAMIDIRIYA SAMAGAMA (NEPV 232)	PB1802
SEEMSASAHITHA (JANATHA) PARAMEEPURA GAMIDIRIYA SAMAGAMA (NEPV 181)	PB1601
SEEMSASAHITHA (JANATHA) PARAPAMULLA DAKUNA PUBUDU GAMIDIRIYA SAMAGAMA (NEPV 439)	PB1603
SEEMSASAHITHA (JANATHA) POLGAHAARAWA GAMIDIRIYA SAMAGAMA (NEPV 185)	PB1600
SEEMSASAHITHA (JANATHA) THERUNGAMA GAMIDIRIYA SAMAGAMA (NEPV 213)	PB1598
SEEMSASAHITHA (JANATHA) THISPANEGAMA VIRANA THIRASHAKTHI GARAM SANWARDHANA SAMAGAMA (NEPV 93)	PB1790
SEEMSASAHITHA (JANATHA) USWEWA GAMIDIRIYA SAMAGAMA (NEPV 537)	PB1599
SEEMSASAHITHA GADOLBEDDA GAMANEGUMA JANATHA SAMAGMA	PB4717
SEENEC	PV00275928
SEENI COLOMBO	PV00273696
SEENICC GENAIROO	PV83375
SEENIGAMA B P O TECHNOLOGIES	PV76150
SEEP PLANNING & ENGINEERING SERVICES	PV74403
SEEPET ANIMAL CARE	PV00209747
SEEPET DOG TREAT	PV00207600
SEER BIO	PV120263
SEERA LANKA	GL00238292
SEERADA ACCOUNTING & MANAGEMENT CONSULTANTS	PV21693
SEERAY INVESTMENTS	PV86430
SEEROCK BOUTIQUE HOTEL AND SPA	PV97375
SEEROCK HOLIDAYS	PV00211710
SEES LANKA	PV15852
SEESARA HOLDINGS	PV00203676
SEESIGN CONSTRUCTION	PV75321
SEESILAN	PV00253185
SEETAWAKA INVESTMENTS	PV67196
SEETEC HOLDINGS	PV101864
SEETHA BANQUET HALLS	PV96502
SEETHA CONSORTIUM	PV101859
SEETHA GROUP	PV3646
SEETHA HOLDLINGS	PV388
SEETHA IMPORTS	PV3365
SEETHA METAL CAN INDUSTRIES	PV63497
SEETHA RESTAURANT & CATERERS	PV77987
SEETHA RESTAURANTS	PV84815
SEETHA STORES	PV119530
SEETHA SUPER MARKETS	PV97093
SEETHA TRADE CENTRE	PV772
SEETHA TRAVELS	
SEETHAA RAAM BRIDAL & BEAUTYCENTRE	PV00287890
SEETHAELIYA PLANTATIONS	PV75947
SEETHAS FASHION GARMENTS LANKA	PV11571
SEETHAWAKA AGRI PRODUCTS	PV00222293
SEETHAWAKA DISTRIBUTORS	PV106424
SEETHAWAKA GLOBAL HOLDINGS	PV00250081
SEETHAWAKA HARITHA FARM	PV00261525
SEETHAWAKA INTERNATIONAL BUDDHIST COLLEGE	
SEETHAWAKA MIRACLE ADVENTURE PARK	PV00219617
SEETHAWAKA NATURAL FOODS	PV00214807
SEETHAWAKA PLANTATIONS	PV89158
SEETHAWAKA ROOFINGS	PV00235660
SEETHAWAKA SECURITY SERVICES	PV106430
SEETHAWAKA TRANSPORT AND LOGISTIC SERVICES	PV106428
SEETTUWA	PV00203403
SEEVALI FOUNDATION	GA00231566
SEEVIEM FINANCIAL SERVICES	PV5700
SEEVIEW PROPERTY DEVELOPERS	PV16870
SEEWELL GUARD SECURITY SERVICE	PV00243352
