name	registration_no
A AND D TRANSPORT	PV00258206
A AND D ADVERTISING	PV17844
A A GRACE SEAFOOD	PV00252311
A AND A MARINE SERVICES	PV65736
A AND D CONSULTANTS	PV71220
A A JAIN HOLIDAYS	PV79119
A A R SEA FOOD EXPORT AND IMPORT	PV121262
A A A LANKA EXPORTS & IMPORTS	PV00266572
A A A TRADE LANKA	PV00273086
A A COUNTRY Z DEVELOPERS	PV00207906
A A COUNTRY Z DEVELOPERS	PV00207906
A AND Z TRAVELS & TOURS	PV99357
A A H ACCOUNTING	
A AND R CONSTRUCTION MANPOWER	PV00232368
A AND D CARS	PV12701
A A FOOD CITY	PV00238404
A A T MARKETING	PV00208749
A AND W ENTERPRISES	PV17101
A A NEW LANKA HOLDINGS	PV00251267
A A R K ENGINEERING	PV95340
A A FOOD CITY	PV00238404
A A A IMPEX	PV00241520
A A OFFICE AUTOMATION	PV00227940
A A ASTUTE INTERNATIONAL	PV00234361
A A A TRADING ENTERPRISES	PV00215500
A A R K ENGINEERING	PV95340
A AND M.I.T SOLUTION 	PV86879
A AND A ECO	PV85336
A AND T PROPERTY DEVELOPERS	PV122312
A A GRACE SEAFOOD	PV00252311
A AND D ADVERTISING	PV17844
A AND G HOLDINGS	PV91904
A AND D ENTERPRISES	PV3336
A AND S DESIGN ENGINEERS	PV00281600
A A A PRODUCTION AND DISTRIBUTION	PV00272230
A A RESOVERY SERVICES	PV89217
A A R B PEARL	PV109340
A A COUNTRY Z DEVELOPERS	PV00207906
A AND D CARS	PV12701
A AND G INVESTMENTS	PV77765
A A A P ENTERPRISES	PV00272997
A A T CORPORATE SERVICES	PV131731
A AND R RANGIRA WOODLIFE	PV90796
A A A MARKETING LANKA	PV00288583
A AND D SERVICE INTERNATIONAL	PV00272285
A AND A MARINE SERVICES	PV65736
A A A LANKA EXPORTS & IMPORTS	PV00266572
A A R SEA FOOD EXPORT AND IMPORT	PV121262
A AND S TILE YARD	PV97723
A AND Z TRAVELS & TOURS	PV99357
A AND M SUHADA ENTERPRISES	PV10053
A AND D MARKETING	PV71237
A AND E PRODUCTS LANKA	PV16784
A AND A ECO	PV85336
A AND D HOLDINGS LANKA	PV00211748
A A T CORPORATE SERVICES	PV131731
A A TRADING INVESTMENT & CONSULTANCY	PV00226261
A AND D TRANSPORT	PV00258206
A AND G HOLDINGS	PV91904
A AND R ASSOCIATES & CONSULTANTS	PV125682
A AND E PRODUCTS LANKA	PV16784
A AND A ASSOCIATES	PV20853
A A A P ENTERPRISES	PV00272997
A A A INDUSTRIES	PV00232474
A AND M SUHADA ENTERPRISES	PV10053
A AND R AUTO SPA	PV70302
A AND D MARKETING	PV71237
A AND D DISTRIBUTORS	PV83845
A A A MARKETING LANKA	PV00288583
A AND D ENTERPRISES	PV3336
A AND Z TRAVELS & TOURS	PV99357
A A D PLANTATIONS	PV92062
A AND D DISTRIBUTORS	PV83845
A AND D CARS	PV12701
A A P PROPERTY DEVELOPMENT	PV130500
A AND S DREAM PAINTERS	PV106556
A A A IMPEX	PV00241520
A AND R CONSTRUCTION MANPOWER	PV00232368
A A SPORTS	PV00232787
A A G HOLDINGS	PV112186
A A HUMAN CAPITAL RESOURCES	PV89917
A A T M HOLDINGS	PV00237883
A AND R MARINE SOLUTIONS	PV96431
A A A CONSTRUCTON AND CONSULTANT	PV00228607
A A T ENTERPRISES	PV00226393
A AND D MARKETING	PV71237
A AND D SERVICE INTERNATIONAL	PV00272285
A A T CONSTRUCTION	PV78775
A A F LANKA	PV00278310
A A JAPAN	PV128919
A A JAPAN	PV128919
A A A HOSPITALITY COMPANY	PV120689
A AND S GALLERY	PV70691
A A ONE	PV84408
A A A SAKA	PV62550
A A GANESHAN IMPORT & EXPORT	PV00263812
A A P A  EXAMINATIONS	PV00274137
A A LANKA SUPPLIERS	PV00271620
A AND A HOLDINGS	PV20527
A A A GROUP	PV60184
A A A GROUP	PV60184
A AND E D ENGINEERING CO.	PV70060
A A AQUA INTERNATIONAL	PV00239416
A A WIJENAYAKE CONSTRUCTIONS	PV00208935
A A A TECH	PV123747
A A A RATED PRODUCTIONS	PV00219815
A AND V AUTO ENTERPRISES	PV00245653
A AND D HOLDINGS	PV73524
A A A S ENTERPRISES	PV105785
A A TRUST INVESTMENT	PV105486
A A 3 HOLDINGS	PV00237466
A A A S ENTERPRISES	PV105785
A AND M INVESTMENTS	PV108509
A AND G MARINE LANKA	PV00211438
A AND D MICRO CREDIT	PV102662
