name	registration_no
A E L PORT SERVICES	PV92765
A E  SOLAR  PANELS	PV00228883
A E C PROPERTIES	PV66522
A ENTERPRISES	PV66511
A E P LANKA AUTO PLUS	PV81030
A E CRIST PRODUCTS	PV117466
A E R EXPORTS & SHIPPING	PV00209637
A E CONSULTANTS	PV83759
A E PROJECT INTERNATIONAL	PV85435
A E S PREMIUM	PV00239082
A E QUALITY APPARELS	PV118252
A E L ENGINEERING	PV00219983
A E  SOLAR  PANELS	PV00228883
A E CRIST PRODUCTS	PV117466
A E CONSULTANTS	PV83759
A E PROJECT INTERNATIONAL	PV85435
A E T HOLDINGS	PV94826
A E P LANKA	PV74600
A E M C CONSULTANT	PV129133
A E N C HOLDINGS	PV00243883
A E C C GLOBAL	PV00225510
A E A MACHINERY INTERNATIONAL	PV123883
