name	registration_no
A H TECHNOLOGY	PV00284236
A H TEENUS HOLDINGS	PV88249
A H L EXPORTS & IMPORTS	PV00274724
A H S LANKAN ENTERPRISE	PV129100
A H I HOLDINGS	
A H F GARMENTS	PV00234164
A H RAINBOW HOLDINGS	PV00205370
A H K CONSTRUCTIONS	PV00216562
A H L BUSINESS SOLUTIONS	PV71360
A H R CONSTRUCTION	PV00227367
A H R CONSTRUCTION	PV00227367
A H R LANKA TRADINGS	PV00228423
A H M IMPORT AND EXPORT	PV00259823
A H TECHNOLOGY	PV00284236
A H L BUSINESS SOLUTIONS	PV71360
A H AUTO TRADING	PV94309
A H GLOBAL BUSINESS	PV00240307
A H S INTERNATIONAL	PV60139
A H I HOLDINGS	
A H TEENUS HOLDINGS	PV88249
A HAI INTERNATIONAL	PV64918
A H N ENGINEERING SERVICES	PV00223570
A H RAINBOW HOLDINGS	PV00205370
A H AUTO TRADING	PV94309
A H K CONSTRUCTIONS	PV00216562
A H R GLOBAL HOLDINGS	PV00228460
A H RAINBOW INVESTMENTS	PV00205366
A H N FASHIONS	PV62314
A H R IMPORTS AND EXPORT	PV00205100
A H INTERNATIONAL HOLDINGS	PV00211104
A H INTERNATIONAL HOLDINGS	PV00211104
A H GROUP DIGITAL DATA SYSTEM	PV00249416
A HOT CHIPS	PV111266
