name	registration_no
A S IMPORTS & EXPORTS	PV00283981
A S J AQUATICS	PV00263886
A S D GLOBAL SOLUTIONS	PV125597
A S MOTOR ADVANCE	PV00267287
A S CREDIT & INVESTMENTS	PV00256022
A S S H SOLUTION	PV00260503
A S I SHIPPING AND LOGISTICS	PV474
A S EXIM LANKA	PV00267719
A S H DESIGNS	PV00266238
A S B INNOVATIONS	PV105707
A S V MARKETING	PV82545
A S P PAWN BROKERS	PV00233669
A S P TRAVELS	PV00209174
A S INVESTMENTS	PV87844
A S B SALES SHOP	PV10704
A S I EXPO COMPANY	PV108778
A S C ENGINEERING	PV13777
A S D S - KATANWILA TEA FACTORY	PV17171
A S TEXCO	PV75112
A S S B DISTRIBUTORS	PV00201973
A S T SUPPER	PV00263259
A S V GLOBAL	PV105227
A S T P TEC	PV75727
A S TEXCO	PV75112
A S S B DISTRIBUTORS	PV00201973
A S S IMPORT AND EXPORT	PV00276329
A S B GROUP	PV67611
A S E BUSINESS	PV00246057
A S D ENGINEERING SOLUTIONS	PV00238621
A S R VALUATION AND REAL ESTATE CONSULTANCY	PV00244499
A S W TRADING LANKA	PV117419
A S NEGOMBO TRADING	PV00245106
A S AGRI EXPORTS	PV13750
A S P GLOBAL ALLIANCES	PV13133
A S CAPITAL HOLDINGS	PV00253849
A S D CAMERA	PV00248760
A S J METAAL	PV60527
A S J D CORPORATE CONSULTANTS	PV106196
A STAR LIGHTS	PV00210690
A S M LANKA	PV76774
A S B INTERNATIONAL	PV64940
A S I EXPO COMPANY	PV108778
A SINGLE STEP	PV89418
A S CHATOOR (TEA)	PV7770
A S B SALES SHOP	PV10704
A S TOPICAL INVESTMENT	PV124769
A S T DEVELOPMENTS	PV15620
A S R N EXPORTS & IMPORTS	PV00200110
A S B HOTEL	PV67117
A S LEARNING ACADEMY	PV00287363
A S G PAINT HOUSE	PV00212951
A S IMPORTS & EXPORTS	PV00283981
A S B INNOVATIONS	PV105707
A S EXIM LANKA	PV00267719
A S V MARKETING	PV82545
A S P  INVESTIGATION SECURITY & MANPOWER	PV00218027
A S P DATA MANAGEMENT	PV74065
A SHADE OF BLUE	PV00277117
A S INVESTMENTS	PV87844
A S CHATOOR (TEA)	PV7770
A S T P TEC	PV75727
A S J CONSTRUCTION INTERNATIONAL	PV84827
A S D ENGINEERING SERVICES	PV00231902
A S V AGRO	PV00241089
A S J AQUATICS	PV00263886
A S J TRADE CEYLON	PV00234904
A S P LANKA INTERNATIONAL	PV00237654
A S R VALUATION AND REAL ESTATE CONSULTANCY	PV00244499
A S NEGOMBO TRADING	PV00245106
A S INTERNATIONAL PRECISION PROS	PV00246473
A S P LANKA INTERNATIONAL	PV00237654
A S E BUSINESS	PV00246057
A S RUBBER PRODUCTS	PV00217308
A S W TRADING LANKA	PV117419
A S D ENGINEERING SERVICES	PV00231902
A S T HOLDINGS	PV100415
A S G INTERNATIONAL HOLDINGS	PV00244057
A S P GLOBAL ALLIANCES	PV13133
A S N ASIA	PV109148
A S R VALUATION AND REAL ESTATE CONSULTANCY	PV00244499
A S J D CORPORATE CONSULTANTS	PV106196
A STAR LIGHTS	PV00210690
A S T ENGINEERING LANKA	PV00256701
A S N MALGOLLA TEA FACTORY	PV74095
A S C HOLDING COMPANY	PV00280289
A S IMPORTS & EXPORTS	PV00283981
A S L STEEL	PV00219239
A S EXIM LANKA	PV00267719
A S H DESIGNS	PV00266238
A S T P TEC	PV75727
A S COCOPEAT	PV75033
A S P ENTERPRISES HOLDINGS	PV00261248
A S V MARKETING	PV82545
A S D C SERVICES	PV00209501
A SEVEN CONSTRUCTION & ENGINEERING	
A S K CAR CARE	
A S C ENGINEERING	PV13777
A S TEXCO	PV75112
A S S B DISTRIBUTORS	PV00201973
A S N IT	PV00287173
A SAP CONSULTANTS	PV103910
A S G INTERNATIONAL HOLDINGS	PV00244057
A S CEYLON EXPORTERS	PV00286501
A S LANKA EXPORTERS	PV00233365
A S P C GROUP	PV00224004
A S A BUILDERS	PV00251918
A S B GROUP	PV67611
A S P INTERNATIONAL	PV99180
A S S B DISTRIBUTORS	PV00201973
A S P CONSTRUCTION SOLUTIONS	PV00225006
A S N CONSTRUCTIONS	PV78264
A S J METAAL	PV60527
A S J D CORPORATE CONSULTANTS	PV106196
A STAR LIGHTS	PV00210690
A S M LANKA	PV76774
A S B S INTERNATIONAL CONSULTANTS	PV00228221
A S & S S CREATIONS	PV110134
A S & I HOLDINGS	PV00276613
A S A GROUP	PV00267564
A S MANAGEMENT CONSULTANCY	PV00277800
A STAR INDUSTRIES	PV122206
A S T L GROUP	PV12165
A S B FREIGHT	PV1281
A S TRADING SYSTEMS	PV106607
A S I LANKA INTERNATIONAL	PV125270
A S RENISH	PV104159
A S C S S LANKA	PV00202396
A S P SOFT	PV00203319
A S ARNAN	PV111598
A SQUARE LOGISTIC EXPRESS LANKA	PV00287139
A S TRADING SYSTEMS	PV106607
A SQUARE LOGISTIC EXPRESS LANKA	PV00287139
A S M TRAVELS	PV86800
A S  AUTO HUB	PV00213689
A S M PREMIUM DEVELOPERS	PV00247302
A S G CONSULTING & ENGINEERING	PV00208342
A S N S HOLDINGS	PV00229294
A S T MICRO CREDIT	PV00258990
A S F INTERNATIONAL	PV98110
A S Y SOLAR GROUP	PV103181
A S Y SOLAR GROUP	PV103181
A SCHOOL OF FASHION STUDIES	PV63410
