name	registration_no
S AND A CONSTRUCTION	PV75151
S AND A CONSTURCTIONS & ENGINEERING CONSULTANTS	PV84397
S AND A HOLDINGS	PV6593
S AND A HOMES	PV103494
S AND A RUBBER	PV77696
S AND AKS INNOVATIONS	PV00216632
S AND B GLOBAL SERVICES	PV00209011
S AND B LANKAN EXPORTS	PV16740
S AND D CHEMICALS	PV95538
S AND F ASSOCIATES	PV64539
S AND F CONSULTING LANKA	PV00248539
S AND G APPARELS	PV17195
S AND I INTERANTIONAL	PV60575
S AND J FRENDZ	PV71625
S AND K AGRO LANKA	PV67124
S AND K SAFARI VILLAGE	PV15081
S AND M GLOBAL TRADING	PV85289
S AND N HOLDINGS	PV00282877
S AND P INVESTMENTS	PV7663
S AND R CEYLON MICRO CREDIT	PV00259169
S AND R GLOBAL CARE	PV00267192
S AND S CLEARING AND FORWARDING	PV19737
S AND S PRINTERS	PV15208
S AND S SERVICES	PV00261637
S AND T PROMOTIONS	PV70781
S AND T PROPERTY DEVELOPERS	PV7340
S AND T STEEL INDUSTRIES	PV16683
S AND V INTERNATIONAL	PV62872
S AND V INVESTMENT	PV113098
